taxon_name,family,source_details,name_resolution_and_type,references,source_id,year,text_from_references_for_scraping,plant_growth_form_simpler,woodiness_recoded,simplified_phrase,fire_response,post_fire_recruitment,site,fire_severity,fire_exposure_level,bud_bank_location,storage_organ,life_history,fire_ephemeral,fire_and_establishing
Hibiscus sankowskyorum,Malvaceae,APC_accepted,binomial,"species - Craven 2016, Muelleria 35: 3–14",Craven_2016,2016,"Shrub, ortree,apparentlyevergreen,oftenmultistemmed from ground level, perhaps as a response to fire, 2–3(– 10) m tall, dbh up to 20 cm. Branchlets hairy, with stellate indumentum of two hair size classes: numerous dense fine short stellate hairs 0.2–0.4 mm long, and scattered tubercle-based coarse stellate hairs 0.4–0.8 mm long; tubercle-based aculei rarely occur (may be 1-rayed coarse stellate hairs). Stipules at length deciduous, hairy, subulate, unlobed, 6–13 mm long with stellate hairs. Petioles 40–95 mm long; climax leaves with the petiole indumentum similar to that of branchlets (lacking aculei). Leaves palmately-veined when trilobed, or pinnately-veined when unlobed. Lamina narrowly ovate, or ovate, or broadly ovate, unlobed, or rarely shallowly 1- or 3-lobed with the lobes shorter than wide, 120–190 mm long, 90–180 mm wide, the margin serrate (rarely crenate), base cuneate, or truncate, the apex acute, or obtuse, concolorous, with whitish hairs, indumentum more dense on abaxial surface. Abaxial surface with the midrib and primary vein indumentum similar to that of the interveinal regions, with moderately to very dense, mainly fine stellate hairs. Foliar nectary present at base of the lamina, 4–7 mm long. Distal leaves on flowering shoots reduced in shape, narrowly elliptic, or elliptic, or narrowly ovate, distinctly petiolate on reproductive shoots. Flowers solitary in leaf axils, not pedunculate, chasmogamous. Pedicels hairy, 15–38 mm long, with stellate hairs. Epicalyx present, persistent, with fine stellate hairs and tubercle-based coarse stellate hairs, 9–11-lobed, 17–27 mm long, segments flattened, free at the base, shorter than the calyx, or equally as long as the calyx, 0.6–1 times the length of the calyx at anthesis, straight, or incurved, narrowly but distinctly spathulate, or subulate, with apex entire. Calyx at anthesis not splitting (5-lobed or -partite but not splitting per se), not adnate to the corolla and not falling with it after anthesis, whitish, with fine and coarse moderately dense or very dense stellate hairs, evenly distributed on the abaxial surface, lobes narrowly triangular with prominent marginal ribs, apex acute, 25–35 mm long at anthesis, nectary absent. Petals white, red petal spot present, 60–95 mm long. Staminal column straight, 5-toothed at the apex, c. 45 mm long. Stamens scattered along distal c. 25 mm of the column, inserted singly. Anthers dark red. Pollen dark red. Style one, 5-branched, branches c. 4 mm long, exserted c. 14 mm beyond apex of staminal column. Stigmas entire, capitate. Ovary hairy. Calyx in fruit not distinctly inflated or accrescent. Fruits dry, dehiscent, a capsule. Capsules ovoid, c. 20 mm long with ascending dense hairs, capsule beak present. Seeds glabrous.",shrub tree,woody,"multi-stemmed, perhaps as a response to fire",resprouts,,,,,,,,,
Seorsus intratropicus,Myrtaceae,APC_accepted,binomial,"species - Rye 2008, Nuytsia 18: 235–257",Rye_2008,2008,"Erect spreading shrub, 1–1.7(3) m tall; young branchlets leafy, somewhat compressed at right angles to the orientation of the pair of leaves directly above, with prominent bands of pale grey epidermis below each petiole. Leaves antrorse to widely spreading, dense on young shoots, soon shed. Petioles 0.6–0.9 mm long, often poorly defined. Leaf blades very narrowly obovate in outline, 6–8.5 mm long, 0.5–0.8 mm wide, 0.8–1 mm thick, obtuse, adaxial surface very deeply convex, abaxial surface furrowed, with scattered moderately large oil glands. Peduncles at 1–8 nodes towards the end of each branchlet, 1.0–1.2 mm long. Bracteoles apparently deciduous, c. 1.5 mm long, c. 0.6 mm wide. Pedicels 0.4–0.6 mm long, 5-ribbed. Flowers 6–7.5 mm diam. Hypanthium 1.9–2.5 mm long. Disc minutely dotted with prominent white glands. Sepals depressed to broadly ovate, 1.0–1.2 mm long, 1.5–1.6 mm wide, erect, dorsally ridged on midrib, possibly somewhat reddish outside. Petals broadly obovate, 2.3–3 mm long, creamy white. Androecium of usually 57–70 stamens but up to 78 recorded, with 10–15(18) stamens per fascicle; fascicles c. 1 mm wide at base, the filaments connate for half or more of their length and up to 2 mm long. Anthers c. 0.2 mm long, c. 0.4 mm wide. Ovary 3-locular; placenta broadly elliptic with marginal small circular attachment points for the ovules, flat, very broadly attached by an oval hollow structure; ovules 12–16 per loculus. Style 1.4–1.8 mm long, base separated by 0.4–0.5 mm from the placentas; stigma c. 0.3 mm diam. Fruit 2/3–3/4 inferior, c. 2.5 mm long, c. 2.5 mm diam.; hypanthium cup-shaped; disc flat around the margin, somewhat raised in centre into 3 valves, conspicuously dotted with minute white oil glands; placentas elliptic with acute ends, c. 0.7 mm long, c. 0.35 mm wide, c. 0.15 mm thick. Seeds laterally compressed, 0.8–0.9 mm long, c. 0.35 mm wide, 0.6–0.7 mm deep, the basal and distal inner facets roughly equal and the hilum above the middle of the basal inner facet, with a large modified region on the inner surface that is more or less triangular from side view and has narrowly oblong cells; testa pale yellowish brown, with longitudinal rows of many transversely oblong cells. Chaff pieces probably numerous, similar in appearance to seeds except that they tend to be only c. 0.2 mm wide, with the crustaceous wall similar to or thicker than that of the seeds. Distribution and habitat. Endemic to the Limmen Bight region of Northern Territory, recorded from near Limmen Gate on Bohemia Downs Station. Astartea intratropica grows in cracks on sandstone blocks and has recently been recorded as the dominant species in this restricted habitat. Mueller (1859) described the habitat as wet rocky slopes and around springs and Bentham (1867: 91) described it as ‘ravines of the sandstone table-land’. Phenology. Flowers and fruits recorded from late August to mid-September. Seorsus intratropicus is probably not lignotuberous, but its rocky habitat presumably gives it significant protection from fires",shrub,woody,occurs in fire-protected rocky habitats,,,,,fire_avoidance_among_rocks,,,,,
Thryptomene dampieri,Myrtaceae,APC_accepted,binomial,"species - Rye 2014, Nuytsia 24: 269–306",Rye_2014,2014,"Shrub usually low and spreading, often rooting adventitiously from prostrate or sprawling stems, 0.2–0.7(–1) m high, up to 1.5 m wide; flowering branchlets with 2–8 pairs of flowers usually in a dense cluster. Leaves mostly crowded and widely antrorse. Petioles 0.2–0.5 mm long. Leaf blades often somewhat recurved towards apex (but with keel apex incurved), mostly broadly obovate to depressed-obovate and 1.3–3 mm long, 1.5–2.2 mm wide, broadly obtuse, usually entire but sometimes minutely denticulate; abaxial surface convex, with 3 or 4(5) main rows of oil glands on each side of midvein and 3–5 glands < 0.1 mm diam. in each of the two central rows, rarely with only 1 or 2 rows of glands obvious; adaxial surface concave. Peduncles 1-flowered, 0.2–0.8 mm long. Bracteoles persistent after fruit shed, with the keel green and leaf-like, with broad scarious margins below the thick green apical point, broadly ovate, 0.6–1.6 mm long, denticulate on the scarious margins or entire. Pedicels ± absent. Flower buds with a concave or flat apex. Flowers 4–6 mm diam. Hypanthium with many fine irregular longitudinal wrinkles or similar irregular patterning. Sepals fairly erect in flower, tightly closed inwards in fruit, very broadly ovate or depressed-ovate, 0.5–0.9 mm long, 1–1.4 mm wide, pale pink, minutely denticulate or sometimes entire, often distinctly auriculate. Petals erect at base and widely spreading above in flower, loosely closed inwards in fruit, usually broadly obovate, 1.5–2 mm long, pink or pink-purple, ± entire. Stamens usually 10, alternating between the sepals and petals, ± equidistant. Filaments 0.4–0.8 mm long. Anthers c. 0.3 mm wide. Style 0.5–0.8 mm long. Fertile fruits depressed-obovoid, c. 1.4 mm long, c. 1.8 mm diam.; hypanthium developing a pattern of irregular longitudinal furrows; seed transversely reniform, 1.1–1.2 mm high, 1.4–1.5 mm across. Distribution and habitat. Extends from the Exmouth area south along the west coast to the Hamelin Bay area, occurring off-shore on Dorre and Dirk Hartog Islands (Figure 4). Occurs on sand dunes and limestone, for example on white beaches or on red sand overlying limestone, often in low heath including spinifex or in taller Acacia shrubland, also recorded in salty brownish sand. Phenology. Flowers from April to September. Fruits from August to October. Notes. This species is recorded as regenerating successfully from underground parts after fires. The bracteoles have a leafy keel and broad membranous sides, the apex usually prominent and leaf-like. The hypanthium is rugose, usually with numerous irregular wrinkles and grooves.",shrub,woody,resprouts from underground after fire,resprouts,,,,,underground_buds,,,,
Pyracantha coccinea,Rosaceae,APC_accepted,binomial,species - vro.agriculture.vic.gov.au/dpi/vro/vrosite.nsf/pages/weeds_scarlet-firethorn,,,Firethorn is a large evergreen shrub…it typically grows into a tangled mound up to 10 feet…It is armed with sharp thorns that hide among the dark glossy green leaves (Floridata 2008).,shrub,woody,no fire information,,,,,,,,,,
Hamelia patens,Rubiaceae,APC_accepted,binomial,species - Wikipedia,,,"Hamelia patens is a large perennial shrub or small tree in the family Rubiaceae, that is native to the American subtropics and tropics. Firebush has orangish-red tubular flowers, which recruit hummingbirds and butterflies for pollination.[3] The corollas vary greatly in length, making them attractive to a wide range of pollinators.[4] The fruit is a small dark red berry, turning black at maturity.",shrub,woody,no fire information,,,,,,,,,,
Solanum sejunctum,Solanaceae,APC_accepted,binomial,"species - Brennan 2006, The Beagle, Records of the Museums and Art Galleries of the Northern Territory 22: 1-7",Brennan_2006,2006,"A clonal shrub with erect stems to  m, branching above. Branches unarmed or with a few small prickles to  mm long, densely pubescent with sessile and stipitate stellate hairs. Petiole .25–2.5 cm long, unarmed or with a few conical prickles to 2 mm long.  Leaves somewhat variable in size, lower and earlier leaves 11–13 cm long, 4.5–5.5 cm wide, upper and later leaves 5–8.5 cm long, 2.5–3 cm wide; lamina ovate-lanceolate. Leaf base oblique with up to 6–7 mm between insertion of margins; apex acute, margin entire. Upper leaf surface unarmed, pubescent with sessile and stipitate stellate hairs, lamina sometimes visible, grey-green to dull khaki-green; lower leaf surface densely pubescent, lamina obscured, paler grey-green. ;doesn't profilerate after fire; Flowering and fruiting material has been collected during the early part of the dry season from April to June.",shrub,woody,does not proliferate after fire,,no_post_fire_recruitment,,,,,,,,
