NHNSW_2022,PlantNET_flora,Melichrus urceolatus,"fire response regrowth from surviving rootstocks, no seedlings recorded less than 1 year after fire (purdie 1977).",resprouts from rootstock after fire; no seedlings observed one year after fire,,,,,,resprouts,scored_from_excerpt,no_post_fire_recruitment,scored_from_excerpt,rootstock,scored_from_excerpt,,,,,,,,,,,,,,,,,,,,,,,,,,,,,,,,,,rootstock,scored_from_excerpt,,
NHNSW_2022,PlantNET_flora,Monotoca elliptica,"fire response resprouts from epicormic shoots (at la perouse), though survival may be patchy. most of population killed by high intensity fire (at lane cove river 1/1994), a few resprouting, no seedlings seen (kubiak pers.",killed by hot fires; no seedlings observed after fire,,,high,,,fire_killed,scored_from_excerpt,no_post_fire_recruitment,scored_from_excerpt,,,,,,,,,,,,,,,,,,,,,,,,,,,,,,,,,,,,,,,
NHNSW_2022,PlantNET_flora,Monotoca elliptica,"fire response resprouts from epicormic shoots (at la perouse), though survival may be patchy. most of population killed by high intensity fire (at lane cove river 1/1994), a few resprouting, no seedlings seen (kubiak pers.",resprouts epicormically after fire but may be patchy,,,low_to_moderate,,,partial_resprouting,scored_from_excerpt,,,epicormic_buds,scored_from_excerpt,,,,,,,,,,,,,,,,,,,,,,,,,,,,,,,,,,,,,
NHNSW_2022,PlantNET_flora,Monotoca scoparia,"fire response stems killed, regenerates from basal sprouts (e g at agnes banks (benson 1981), after high-intensity fire at katandra 1/1994, l.mcd.). no seedlings recorded less than 1 year after fire (purdie 1977). a few resprouting plants flowering within 17 months of  high intensity fire (at lane cove river & narrabeen lake 1/1994, kubiak pers. low palatability, mortality unaffected by grazing after fire (leigh & holgate 1979).",resprouts from base after hot fires; no seedlings observed one year after fire; some resprouting plants flowering within 17 months of hot fire,,,,,,resprouts,scored_from_excerpt,no_post_fire_recruitment,scored_from_excerpt,basal_buds,scored_from_excerpt,,,,,,,,,,,,,,,,,,,,,,1.4,population,minimum,,,,,,,,,,,,,
NHNSW_2022,PlantNET_flora,Muehlenbeckia sp. Mt Norman (J.T.Hunter 3847),"mostly in rocky, higher-altitude sites following disturbance such as fire or clearing for powerlines.",common/found after fire,,,,,,,,post_fire_recruitment,scored_from_excerpt,,,,,,,,,,,,,,,,,,,,,,,,,,,,,,,,,,,,,,,
NHNSW_2022,PlantNET_flora,Olax retusa,"description: erect shrub to 60 cm high, single-stemmed or many-branched following regrowth after fire;",regrowth after fire,,,,,,resprouts,scored_from_excerpt,,,,,,,,,,,,,,,,,,,,,,,,,,,,,,,,,,,,,,,,,
NHNSW_2022,PlantNET_flora,Phylloglossum drummondii,"distribution and occurrence: in swampy areas of coastal heath, chiefly evident after fire.",conspicuous after fire,,,,,,resprouts,scored_from_excerpt,,,,,,,,,,,,,,,,,,,,,,,,,,,,,,,,,,,,,,,,,
NHNSW_2022,PlantNET_flora,Pittosporum undulatum,s.can be an aggressive post-fire coloniser of the understorey layer in sclerophyll forest.,coloniser after fire,,,,,,,,post_fire_recruitment,scored_from_excerpt,,,,,,,,,,,,,,,,,,,,,,,,,,,,,,,,,,,,,,,
NHNSW_2022,PlantNET_flora,Pomaderris walshii,"commonwealth epbc: critically endangered populations of plants may be threatened by changes in fire or flood frequencies, or by future use of private land.",threatened by changing fire and flood frequencies and land use,,,,,,,,,,,,,,,,,,,,,,,,,,,,,,,,,,,,,,,,,,,,,,,changing_disturbance_regimes land_use,
NHNSW_2022,PlantNET_flora,Prasophyllum affine,"flowering: november-december, flowering more freely after fire.",flowering enhanced by fire,,,,,,,,,,,,,,,,,,,,,,,,,,,,fire_enhanced_flowering,scored_from_excerpt,,,,,,,,,,,,,,,,,,,
NHNSW_2022,PlantNET_flora,Prasophyllum appendiculatum,"flowering: october-november, especially after fire.",flowering enhanced by fire,,,,,,,,,,,,,,,,,,,,,,,,,,,,fire_enhanced_flowering,scored_from_excerpt,,,,,,,,,,,,,,,,,,,
NHNSW_2022,PlantNET_flora,Prasophyllum australe,"s.flowering: september-january, flowering more freely after fires.",flowering enhanced by fire,,,,,,,,,,,,,,,,,,,,,,,,,,,,fire_enhanced_flowering,scored_from_excerpt,,,,,,,,,,,,,,,,,,,
NHNSW_2022,PlantNET_flora,Prasophyllum lindleyanum,flowering more regularly following fires or mowing.,flowering enhanced by fire,,,,,,,,,,,,,,,,,,,,,,,,,,,,fire_enhanced_flowering,scored_from_excerpt,,,,,,,,,,,,,,,,,,,
NHNSW_2022,PlantNET_flora,Prasophyllum patens,"s.flowering: october-december, usually after fires.",flowering enhanced by fire,,,,,,,,,,,,,,,,,,,,,,,,,,,,fire_enhanced_flowering,scored_from_excerpt,,,,,,,,,,,,,,,,,,,
NHNSW_2022,PlantNET_flora,Prasophyllum sylvestre,"s.flowering: october-january, usually after disturbance or burning.",flowering enhanced by fire,,,,,,,,,,,,,,,,,,,,,,,,,,,,fire_enhanced_flowering,scored_from_excerpt,,,,,,,,,,,,,,,,,,,
NHNSW_2022,PlantNET_flora,Pyrorchis nigricans,"w.s.flowering: august-november, often after hot bushfires the previous summer.",flowering enhanced by hot summer fires,,,high,,summer,,,,,,,,,,,,,,,,,,,,,,,fire_enhanced_flowering,scored_from_excerpt,,,,,,,,,,,,,,,,,,,
NHNSW_2022,PlantNET_flora,Romneya,"ovary of 7-12 united carpels, placentation parietal, ovules born on inwardly firected plates which almost meet at the centre.",no fire information,,,,,,,,,,,,,,,,,,,,,,,,,,,,,,,,,,,,,,,,,,,,,,,,
NHNSW_2022,PlantNET_flora,Rosaceae,"many are favourite ornamental and hedge garden plants, including roses, firethorns, hawthorns, photinias, cotoneasters;",no fire information,,,,,,,,,,,,,,,,,,,,,,,,,,,,,,,,,,,,,,,,,,,,,,,,
NHNSW_2022,PlantNET_flora,Senecio quadridentatus,"distribution and occurrence: grows in disturbed situations, especially after fire, widespread.nsw subdivisions: nc, cc, sc, nt, ct, st, nws, cws, sws, nwp, swp, nfwp, sfwp other australian states: qld vic.",common/found after fire,,,,,,,,post_fire_recruitment,scored_from_excerpt,,,,,,,,,,,,,,,,,,,,,,,,,,,,,,,,,,,,,,,
NHNSW_2022,PlantNET_flora,Seringia,"juvenile growth, especially post-fire, has trilobed, larger leaves with undulate, mainly serrate margins and larger flowers than do the mature plants.",genus-level observation; juvenile growth after fire; resprouts after fire?,,,,,,,,,,,,,,,,,,,,,,,,,,,,,,,,,,,,,,,,,,,,,,,,
NHNSW_2022,PlantNET_flora,Seringia arborescens,,resprouts after fire (inferred from genus),,,,,,resprouts,inferred_from_genus,,,,,,,,,,,,,,,,,,,,,,,,,,,,,,,,,,,,,,,,,
NHNSW_2022,PlantNET_flora,Seringia corollata,,resprouts after fire (inferred from genus),,,,,,resprouts,inferred_from_genus,,,,,,,,,,,,,,,,,,,,,,,,,,,,,,,,,,,,,,,,,
NHNSW_2022,PlantNET_flora,Seringia denticulata,,resprouts after fire (inferred from genus),,,,,,resprouts,inferred_from_genus,,,,,,,,,,,,,,,,,,,,,,,,,,,,,,,,,,,,,,,,,
NHNSW_2022,PlantNET_flora,Seringia hillii,,resprouts after fire (inferred from genus),,,,,,resprouts,inferred_from_genus,,,,,,,,,,,,,,,,,,,,,,,,,,,,,,,,,,,,,,,,,
NHNSW_2022,PlantNET_flora,Seringia nephrosperma,,resprouts after fire (inferred from genus),,,,,,resprouts,inferred_from_genus,,,,,,,,,,,,,,,,,,,,,,,,,,,,,,,,,,,,,,,,,
NHNSW_2022,PlantNET_flora,Solanum celatum,"commonly found after fire or disturbance.nsw subdivisions: cc, sc, stthreatened species: nsw bca: endangered flowering: august to october.",common/found after fire,,,,,,,,post_fire_recruitment,scored_from_excerpt,,,,,,,,,,,,,,,,,,,,,,,,,,,,,,,,,,,,,,,
NHNSW_2022,PlantNET_flora,Solanum cinereum,"commonly found after fire or disturbance.nsw subdivisions: nc, cc, sc, nt, ct, st, nws, cws, sws, nwp other australian states: qld vic.",common/found after fire,,,,,,,,post_fire_recruitment,scored_from_excerpt,,,,,,,,,,,,,,,,,,,,,,,,,,,,,,,,,,,,,,,
NHNSW_2022,PlantNET_flora,Solanum hystrix,"distribution and occurrence: grows in recently burnt scrub on sandy plains, recorded for coonabarabran in the late 19th century.",common/found after fire,,,,,,,,post_fire_recruitment,scored_from_excerpt,,,,,,,,,,,,,,,,,,,,,,,,,,,,,,,,,,,,,,,
NHNSW_2022,PlantNET_flora,Solanum simile,"distribution and occurrence: grows in drier, disturbed areas, gravel banks of creeks, roadside verges, abundant after fire, south from dubbo area.nsw subdivisions: cc, ct, cws, sws, nwp, swp, sfwp other australian states: vic.",common/found after fire,,,,,,,,post_fire_recruitment,scored_from_excerpt,,,,,,,,,,,,,,,,,,,,,,,,,,,,,,,,,,,,,,,
NHNSW_2022,PlantNET_flora,Sprengelia incarnata,"recruitment mainly after fire, fire temperature more than 60<u+613c><u+3e31> c for maximum germination, non-dormant fraction of total seed crop 33% (keith pers. fire response killed by high intensity fire (at lane cove river, kubiak pers.",killed by hot fires; regenerates from seed; soil seedbank,,,high,,,fire_killed,scored_from_excerpt,post_fire_recruitment,scored_from_excerpt,,,,,,,,,,,,,,,,,,,,,,,,,,,,,,soil,scored_from_excerpt,,,soil_seedbank_present,scored_from_excerpt,,,,
NHNSW_2022,PlantNET_flora,Stenocarpus,"endemic), qld, n.s.w., n.t., w.sinuatus, the firewheel tree, is often cultivated as an ornamental or street tree.",no fire information,,,,,,,,,,,,,,,,,,,,,,,,,,,,,,,,,,,,,,,,,,,,,,,,
NHNSW_2022,PlantNET_flora,Styphelia longifolia,"distribution and occurrence: grows in dry sclerophyll forest on sandy or gravelly soils on sandstone, in the sydney area from waterfall to broken bay.nsw subdivisions: cc primary juvenile period less than 4 years (at bantry bay after high intensity fire 12/1991, l.mcd.) flowers pale green--yellow, march--september, peak june. usually only single plant seen (l.mcd.) fire response killed by high-intensity fire (at bantry bay 12/1991, katandra 1/1994 l.mcd.).",killed by hot fires; reproductive maturity less than 4 years,,,high,,,fire_killed,scored_from_excerpt,,,,,,,,,,,,,,,,,,,,,,,4,population,maximum,,,,,,,,,,,,,,,,
NHNSW_2022,PlantNET_flora,Styphelia triflora,"fire response killed (bantry bay 1991, l.mcd.), a few seedlings seen within 15 months of high intensity fire (at lane cove river & narrabeen lake 1/1994, kubiak pers.",killed by fire; some seedlings observed 15 months after hot fire,,,,,,fire_killed,scored_from_excerpt,post_fire_recruitment_moderate,scored_from_excerpt,,,,,,,,,,,,,,,,,,,,,,,,,,,,,,,,,,,,,,,
NHNSW_2022,PlantNET_flora,Styphelia tubiflora,"fire response killed by high and medium intensity fire (at lane cove river), localised seedlings reported after fire (kubiak pers.",killed by moderate to hot fires; regenerates from seed after fire,,,low_to_moderate,,,fire_killed,scored_from_excerpt,post_fire_recruitment,scored_from_excerpt,,,,,,,,,,,,,,,,,,,,,,,,,,,,,,,,,,,,,,,
NHNSW_2022,PlantNET_flora,Swainsona pyrophila,"distribution and occurrence: in mallee on sandy or loamy soil, usually only found after fire.nsw subdivisions: swp, sfwp other australian states: vic.",fire ephemeral,,,,,,,,post_fire_recruitment,scored_from_excerpt,,,,,,,,,,,establish_just_after_fire_only,fire_ephemeral_obligate,,,,,,ephemeral,,,,,,,,,,,,,,,,,,,,,
NHNSW_2022,PlantNET_flora,Thelymitra media,"flowering: october-january, especially after fire.",flowering enhanced by fire,,,,,,,,,,,,,,,,,,,,,,,,,,,,fire_enhanced_flowering,scored_from_excerpt,,,,,,,,,,,,,,,,,,,
NHNSW_2022,PlantNET_flora,Trochocarpa laurina,"fire response resprouts from base after high intensity fire (at narrabeen lake 1/1994, kubiak pers. comm.), resprouts from stem/branches after low intensity fires (bofeldt pers.",resprouts epicormically after cool fires,,,low,,,resprouts,scored_from_excerpt,,,epicormic_buds,scored_from_excerpt,,,,,,,,,,,,,,,,,,,,,,,,,,,,,,,,,,,,,
NHNSW_2022,PlantNET_flora,Trochocarpa laurina,"fire response resprouts from base after high intensity fire (at narrabeen lake 1/1994, kubiak pers. comm.), resprouts from stem/branches after low intensity fires (bofeldt pers.",resprouts from base after hot fires,,,high,,,resprouts,scored_from_excerpt,,,basal_buds,scored_from_excerpt,,,,,,,,,,,,,,,,,,,,,,,,,,,,,,,,,,,,,
NHNSW_2022,PlantNET_flora,Woollsia pungens,fire response killed and re-established from soil-stored seed (at brisbane water).,killed by fire; regenerates from seed; soil-stored seedbank,,,,,,fire_killed,scored_from_excerpt,post_fire_recruitment,scored_from_excerpt,,,,,,,,,,,,,,,,,,,,,,,,,,,,,,soil,scored_from_excerpt,,,soil_seedbank_present,scored_from_excerpt,,,,
RBGV_2022,VIC_flora,Acacia obtusifolia,"a small population established recently near mcmahons creek in the upper yarra area was possibly derived from seed carried by fire-fighting equipment, and a 1925 collection purportedly from box hill is most likely a labelling error or from a cultivated plant.",no fire information,,,,,,,,,,,,,,,,,,,,,,,,,,,,,,,,,,,,,,,,,,,,,,,,
RBGV_2022,VIC_flora,Acrotriche serrulata,"this species resprouts after burning, the new leaves sometimes broader than those of mature specimens.",resprouts after fire,,,,,,resprouts,scored_from_excerpt,,,,,,,,,,,,,,,,,,,,,,,,,,,,,,,,,,,,,,,,,
RBGV_2022,VIC_flora,Actinotus forsythii,this species requires disturbances such as fire or soil upheaval to stimulate germination and flowering.,flowering enhanced by fire; germination is stimulated by fire,,,,,,,,post_fire_recruitment,scored_from_excerpt,,,,,,,,,,,,,,,,,,,fire_enhanced_flowering,scored_from_excerpt,,,,,,,,,,,,,,,,,,,
RBGV_2022,VIC_flora,Amelichloa caudata,the presence of cleistogenes within the leaf-sheaths limits the effectiveness of normal methods of control (e g slashing or burning) and as a result this species has the potential to infest vast tracts of pasture in the drier agricultural districts.,uninterpretable,,,,,,,,,,,,,,,,,,,,,,,,,,,,,,,,,,,,,,,,,,,,,,,,
RBGV_2022,VIC_flora,Asterolasia asteriscophora subsp. albiflora,and inappropriate fire regimes threaten this subspecies.,threatened by inappropriate fire regimes,,,,,,,,,,,,,,,,,,,,,,,,,,,,,,,,,,,,,,,,,,,,,,,inappropriate_fire_regime,
RBGV_2022,VIC_flora,Astrotricha parvifolia subsp. 1,capable of regenerating after fire from soil-stored seed.,regenerates after fire from seed; soil seedbank,,,,,,fire_killed,scored_from_excerpt,post_fire_recruitment,scored_from_excerpt,,,,,,,,,,,,,,,,,,,,,,,,,,,,,,soil,scored_from_excerpt,,,soil_seedbank_present,scored_from_excerpt,,,,
RBGV_2022,VIC_flora,Austrostipa drummondii,often common following fire.,common/found after fire,,,,,,,,post_fire_recruitment,scored_from_excerpt,,,,,,,,,,,,,,,,,,,,,,,,,,,,,,,,,,,,,,,
RBGV_2022,VIC_flora,Austrostipa macalpinei,"rare in victoria, but may be locally abundant following fires.",common/found after fire,,,,,,,,post_fire_recruitment,scored_from_excerpt,,,,,,,,,,,,,,,,,,,,,,,,,,,,,,,,,,,,,,,
RBGV_2022,VIC_flora,Austrostipa nivicola,"prominent and flowering profusely in first seasons following fires, otherwise flowering is often sparse.",flowering enhanced by fire,,,,,,,,,,,,,,,,,,,,,,,,,,,,fire_enhanced_flowering,scored_from_excerpt,,,,,,,,,,,,,,,,,,,
RBGV_2022,VIC_flora,Banksia canei,opening only after fire;,serotinous,,,,,,,,post_fire_recruitment,scored_from_excerpt,,,canopy_seedbank_present,scored_from_excerpt,,,,,,,,,,,,,,,,,,,,,,,,serotinous,scored_from_excerpt,canopy,scored_from_excerpt,serotinous,scored_from_excerpt,,,,,,
RBGV_2022,VIC_flora,Banksia ericifolia subsp. ericifolia,mostly opening with fire.,serotinous,,,,,,,,post_fire_recruitment,scored_from_excerpt,,,canopy_seedbank_present,scored_from_excerpt,,,,,,,,,,,,,,,,,,,,,,,,serotinous,scored_from_excerpt,canopy,scored_from_excerpt,serotinous,scored_from_excerpt,,,,,,
RBGV_2022,VIC_flora,Banksia ornata,"follicles to circa 50, 15-30 mm long, densely tomentose-hirsute, grey, opening only after fire.",serotinous,,,,,,,,post_fire_recruitment,scored_from_excerpt,,,canopy_seedbank_present,scored_from_excerpt,,,,,,,,,,,,,,,,,,,,,,,,serotinous,scored_from_excerpt,canopy,scored_from_excerpt,serotinous,scored_from_excerpt,,,,,,
RBGV_2022,VIC_flora,Banksia serrata,"follicles to circa 30, 25-35 mm long, prominently exserted, densely tomentose, brownish, glabrescent, opening only after fire.",serotinous,,,,,,,,post_fire_recruitment,scored_from_excerpt,,,canopy_seedbank_present,scored_from_excerpt,,,,,,,,,,,,,,,,,,,,,,,,serotinous,scored_from_excerpt,canopy,scored_from_excerpt,serotinous,scored_from_excerpt,,,,,,
RBGV_2022,VIC_flora,Banksia spinulosa var. cunninghamii,opening with or without fire.,follicles open with or without fire,,,,,,,,,,,,,,,,,,,,,,,,,,,,,,,,,,,,,,,,,not_serotinous,scored_from_excerpt,,,,,,
RBGV_2022,VIC_flora,Barbarea grayi,"also nsw, acgrows in damp areas near high-altitude streams (e g conglomerate ck, caledonia r., mt buller, buchan r., nunniong plateau, bogong high plains), generally rare, but sometimes locally abundant following fire or local disturbance.",common/found after fire,,,,,,,,post_fire_recruitment,scored_from_excerpt,,,,,,,,,,,,,,,,,,,,,,,,,,,,,,,,,,,,,,,
RBGV_2022,VIC_flora,Burnettia cuneata,seldom or never flowering except in the season following summer fires.,flowers only after summer fires,,,,,summer,,,,,,,,,,,,,,,,,,,,,,,fire_dependent_flowering,scored_from_excerpt,,,,,,,,,,,,,,,,,,,
RBGV_2022,VIC_flora,Caladenia oenochila,flowering can be enhanced dramatically by summer fires.,flowering enhanced by summer fires,,,,,summer,,,,,,,,,,,,,,,,,,,,,,,fire_enhanced_flowering,scored_from_excerpt,,,,,,,,,,,,,,,,,,,
RBGV_2022,VIC_flora,Calandrinia corrigioloides,"often abundant following fire, otherwise rather uncommon.",common/found after fire,,,,,,,,post_fire_recruitment,scored_from_excerpt,,,,,,,,,,,,,,,,,,,,,,,,,,,,,,,,,,,,,,,
RBGV_2022,VIC_flora,Calandrinia eremaea,"abundant in sandy mallee and samphire communities in the north-west, particularly after fire or other disturbance, scattered elsewhere in mild to warm and relatively dry areas of the state where occurring on sand, or commonly in shallow soils on rock-ledges etc.",common/found after fire,,,,,,,,post_fire_recruitment,scored_from_excerpt,,,,,,,,,,,,,,,,,,,,,,,,,,,,,,,,,,,,,,,
RBGV_2022,VIC_flora,Calomeria amaranthoides,also nsin victoria largely confined to eastern lowlands (but with a very disjunct occurrence in the grampians) where usually a pioneer species of flood-prone river banks or wettish forests regenerating after fire.,pioneer species,,,,,,,,post_fire_recruitment,scored_from_excerpt,,,,,,,,,,,,,,,,,,,,,,,,,,,,,,,,,,,,,,,
RBGV_2022,VIC_flora,Calotis cymbacantha,"confined to dune-mallee areas of the far north-west, where sometimes locally common following fire.",common/found after fire,,,,,,,,post_fire_recruitment,scored_from_excerpt,,,,,,,,,,,,,,,,,,,,,,,,,,,,,,,,,,,,,,,
RBGV_2022,VIC_flora,Calotis erinacea,"lom, muf, mum, roball mainland states except acin victoria confined to the further north-west, but there locally common, usually in dune country, particularly in areas of regeneration following fire or other disturbance.",common/found after fire,,,,,,,,post_fire_recruitment,scored_from_excerpt,,,,,,,,,,,,,,,,,,,,,,,,,,,,,,,,,,,,,,,
RBGV_2022,VIC_flora,Cassinia aculeata subsp. aculeata,"apart from the north-west and higher alps, common almost throughout the state, often a pioneer species following fire or other disturbance, and a common roadside plant.",pioneer species,,,,,,,,post_fire_recruitment,scored_from_excerpt,,,,,,,,,,,,,,,,,,,,,,,,,,,,,,,,,,,,,,,
RBGV_2022,VIC_flora,Cassinia longifolia,"locally common in drier open-forests, often on rocky ground, and often forming near-pure stands following fire or other disturbance.",common/found after fire,,,,,,,,post_fire_recruitment,scored_from_excerpt,,,,,,,,,,,,,,,,,,,,,,,,,,,,,,,,,,,,,,,
RBGV_2022,VIC_flora,Cassinia sifton,often a pioneer species following fire or other disturbance.,pioneer species,,,,,,,,post_fire_recruitment,scored_from_excerpt,,,,,,,,,,,,,,,,,,,,,,,,,,,,,,,,,,,,,,,
RBGV_2022,VIC_flora,Cassytha pubescens,"widespread and common throughout most of the state, particularly in lowland open-forest where often abundant following bushfire.",common/found after fire,,,,,,,,post_fire_recruitment,scored_from_excerpt,,,,,,,,,,,,,,,,,,,,,,,,,,,,,,,,,,,,,,,
RBGV_2022,VIC_flora,Ceratogyne obionoides,"lom, mualso wa, sa, qld, nsuncommon herb of sand-ridges in far north-west victoria, but sometimes locally abundant following good rains and/or fires.",common/found after fire,,,,,,,,post_fire_recruitment,scored_from_excerpt,,,,,,,,,,,,,,,,,,,,,,,,,,,,,,,,,,,,,,,
RBGV_2022,VIC_flora,Chenopodium erosum,"prior to extensive fires in the victorian alps in 2003, chenopdium erosum was known in victoria only from rain-shadowed country near suggan buggan. however, following the alpine fires it appeared surprisingly in grassland, heathland and snow-gum woodland on mt buffalo and the bogong high plains where locally common. it was also common post-fire in parts of kosciuszko national park in new south wales. it appears that in alpine environments at least, the seed is very long-lived and requires fire to promote germination.",common/found after fire; germination is stimulated by fire,,,,,,,,post_fire_recruitment,scored_from_excerpt,,,,,,,,,,,,,,,,,,,,,,,,,,,persistent,,,,,,,,,,,,
RBGV_2022,VIC_flora,Chrysocephalum semipapposum,flowering is often promoted by fire or other disturbance and successive seasons may produce largely vegetative growth.,flowering enhanced by fire; resprouts after fire,,,,,,resprouts,scored_from_excerpt,,,,,,,,,,,,,,,,,,,,,fire_enhanced_flowering,scored_from_excerpt,,,,,,,,,,,,,,,,,,,
RBGV_2022,VIC_flora,Chrysocephalum semipapposum subsp. asperum,"the separation of (flowering) large-leaved and (usually non-flowering) small-leaves shoots on this subspecies is often conspicuous, the former apparently often produced as a response to fire or other disturbance.",flowering enhanced by fire; resprouts after fire (inferred from species),,,,,,resprouts,inferred_from_species,,,,,,,,,,,,,,,,,,,,,fire_enhanced_flowering,inferred_from_species,,,,,,,,,,,,,,,,,,,
RBGV_2022,VIC_flora,Chrysocephalum semipapposum subsp. brevifolium,,flowering enhanced by fire; resprouts after fire (inferred from species),,,,,,resprouts,inferred_from_species,,,,,,,,,,,,,,,,,,,,,fire_enhanced_flowering,inferred_from_species,,,,,,,,,,,,,,,,,,,
RBGV_2022,VIC_flora,Chrysocephalum semipapposum subsp. lineare,,flowering enhanced by fire; resprouts after fire (inferred from species),,,,,,resprouts,inferred_from_species,,,,,,,,,,,,,,,,,,,,,fire_enhanced_flowering,inferred_from_species,,,,,,,,,,,,,,,,,,,
RBGV_2022,VIC_flora,Chrysocephalum semipapposum subsp. semipapposum,,flowering enhanced by fire; resprouts after fire (inferred from species),,,,,,resprouts,inferred_from_species,,,,,,,,,,,,,,,,,,,,,fire_enhanced_flowering,inferred_from_species,,,,,,,,,,,,,,,,,,,
RBGV_2022,VIC_flora,Codonocarpus cotinifolius,common after fires.,common/found after fire,,,,,,,,post_fire_recruitment,scored_from_excerpt,,,,,,,,,,,,,,,,,,,,,,,,,,,,,,,,,,,,,,,
RBGV_2022,VIC_flora,Comesperma calymega,this condition seems to be related to rapid growth after fire.,resprouts after fire,,,,,,resprouts,scored_from_excerpt,,,,,,,,,,,,,,,,,,,,,,,,,,,,,,,,,,,,,,,,,
RBGV_2022,VIC_flora,Comesperma defoliatum,records of this species from mallee areas are the result of misidentification of virtually leafless forms of calymega apparently a consequence of rapid growth following fire.,no fire information,,,,,,,,,,,,,,,,,,,,,,,,,,,,,,,,,,,,,,,,,,,,,,,,
RBGV_2022,VIC_flora,Commersonia breviseta,"this species is thought to be an obligate seeder, recruiting abundantly following fire.",obligate seeder,,,,,,fire_killed,scored_from_excerpt,post_fire_recruitment,scored_from_excerpt,,,,,,,,,,,,,,,,,,,,,,,,,,,,,,,,,,,,,,,
RBGV_2022,VIC_flora,Commersonia dasyphylla,"a rare species (possibly dependent on fire for germination) in dry open-forest near murrindal in the east of the state, with an apparent disjunct occurrence on mt buffalo (but not reported from there since its collection in 1853).",germination is stimulated by fire,,,,,,,,post_fire_recruitment,scored_from_excerpt,,,,,,,,,,,,,,,,,,,,,,,,,,,,,,,,,,,,,,,
RBGV_2022,VIC_flora,Commersonia prostrata,"germination of soil-stored seeds usually follows flood, fire or earthworks.",germination is stimulated by fire; soil-stored seedbank,,,,,,,,post_fire_recruitment,scored_from_excerpt,,,,,,,,,,,,,,,,,,,,,,,,,,,,,,soil,scored_from_excerpt,,,soil_seedbank_present,scored_from_excerpt,,,,
RBGV_2022,VIC_flora,Convolvulus crispifolius,"flowers in spring and early summer, but possibly also other seasons in response to fire. lom, mum, robalso nt, sin victoria, apparently confined to the far north-west where found on sand-dunes, often only appearing after fire. it is generally rather rare, but may be locally common following fires.",flowering enhanced by fire; common/found after fire,,,,,,,,post_fire_recruitment,scored_from_excerpt,,,,,,,,,,,,,,,,,,,fire_enhanced_flowering,scored_from_excerpt,,,,,,,,,,,,,,,,,,,
RBGV_2022,VIC_flora,Coronidium adenophorum,"rare, but sometimes locally abundant for a season or two following fire.",common/found after fire; rare two years after fire,,,,,,,,post_fire_recruitment,scored_from_excerpt,,,,,,,,,,,establish_just_after_fire_only,fire_ephemeral,,,,,,ephemeral,,,,,,,,,,,,,,,,,,,,,
RBGV_2022,VIC_flora,Coronidium elatum subsp. elatum,more common following fire or ground disturbance.,common/found after fire,,,,,,,,post_fire_recruitment,scored_from_excerpt,,,,,,,,,,,,,,,,,,,,,,,,,,,,,,,,,,,,,,,
RBGV_2022,VIC_flora,Corunastylis arrecta,flowering may be enhanced by fires during the previous summer.,flowering enhanced by summer fires,,,,,summer,,,,,,,,,,,,,,,,,,,,,,,fire_enhanced_flowering,scored_from_excerpt,,,,,,,,,,,,,,,,,,,
RBGV_2022,VIC_flora,Cynoglossum australe,"widespread in a diverse range of habitats through much of the state, often abundant in disturbed sites or following fire.",common/found after fire,,,,,,,,post_fire_recruitment,scored_from_excerpt,,,,,,,,,,,,,,,,,,,,,,,,,,,,,,,,,,,,,,,
