ABRS_2022,Flora_of_Australia,Senna pleurocarpa var. angustifolia,,resprouts from root suckers after fire; regenerates from seed after fire (inferred from species),,,,,,resprouts,inferred_from_species,post_fire_recruitment,inferred_from_species,bud-bearing_root,inferred_from_species,,,,,,,,,,,,,,,,,,,,,,,,,,,,,,,,,,,,,
ABRS_2022,Flora_of_Australia,Senna pleurocarpa var. longifolia,,resprouts from root suckers after fire; regenerates from seed after fire (inferred from species),,,,,,resprouts,inferred_from_species,post_fire_recruitment,inferred_from_species,bud-bearing_root,inferred_from_species,,,,,,,,,,,,,,,,,,,,,,,,,,,,,,,,,,,,,
ABRS_2022,Flora_of_Australia,Senna pleurocarpa var. pleurocarpa,,resprouts from root suckers after fire; regenerates from seed after fire (inferred from species),,,,,,resprouts,inferred_from_species,post_fire_recruitment,inferred_from_species,bud-bearing_root,inferred_from_species,,,,,,,,,,,,,,,,,,,,,,,,,,,,,,,,,,,,,
ABRS_2022,Flora_of_Australia,Solanum,"many species are weedy, some common after fire.",inconclusive genus-level observation,,,,,,,,,,,,,,,,,,,,,,,,,,,,,,,,,,,,,,,,,,,,,,,,
ABRS_2022,Flora_of_Australia,Solanum hystrix,common in recently burnt scrub.,common/found after fire,,,,,,,,post_fire_recruitment,scored_from_excerpt,,,,,,,,,,,,,,,,,,,,,,,,,,,,,,,,,,,,,,,
ABRS_2022,Flora_of_Australia,Solanum simile,abundantafter fire.,common/found after fire,,,,,,,,post_fire_recruitment,scored_from_excerpt,,,,,,,,,,,,,,,,,,,,,,,,,,,,,,,,,,,,,,,
ABRS_2022,Flora_of_Australia,Speculantha clivosa,flowering appears to be stimulated by fire.,flowering enhanced by fire,,,,,,,,,,,,,,,,,,,,,,,,,,,,fire_enhanced_flowering,scored_from_excerpt,,,,,,,,,,,,,,,,,,,
ABRS_2022,Flora_of_Australia,Speculantha recta,"flowering is greatly reduced in overgrown situations and appears to be stimulated by fires, certainly in second and third year after burn.",flowering enhanced by fire,,,,,,,,,,,,,,,,,,,,,,,,,,,,fire_enhanced_flowering,scored_from_excerpt,,,,,,,,,,,,,,,,,,,
ABRS_2022,Flora_of_Australia,Speculantha ventricosa,flowering seems to be enhanced in second and third years after burn.,flowering enhanced by fire,,,,,,,,,,,,,,,,,,,,,,,,,,,,fire_enhanced_flowering,scored_from_excerpt,,,,,,,,,,,,,,,,,,,
ABRS_2022,Flora_of_Australia,Speculantha vernalis,flowering is promoted in the season following summer fires.,flowering enhanced by summer fires,,,,,summer,,,,,,,,,,,,,,,,,,,,,,,fire_enhanced_flowering,scored_from_excerpt,,,,,,,,,,,,,,,,,,,
ABRS_2022,Flora_of_Australia,Speculantha vescula,notes speculantha vescula has taken advantage of the mowing regime that is designed to keep the road verge clear within jervis bay nit more than likely occurs in other habitats in the vicinity of jervis bay but has probably been disadvantaged by the strictly controlled fire regimes imposed throughout the area.,suppressed by human-imposed fire regimes,,,,,,,,,,,,,,,,,,,,,,,,,,,,,,,,,,,,,,,,,,,,,,,inappropriate_fire_regime,
ABRS_2022,Flora_of_Australia,Sporadanthus,some species resprout after fire but sporadanthus strictus and the two new zealand species re-establish from seed.,genus-level observation,,,,,,,,,,,,,,,,,,,,,,,,,,,,,,,,,,,,,,,,,,,,,,,,
ABRS_2022,Flora_of_Australia,Sporadanthus caudatus,resprouts after fire.,resprouts after fire,,,,,,resprouts,scored_from_excerpt,,,,,,,,,,,,,,,,,,,,,,,,,,,,,,,,,,,,,,,,,
ABRS_2022,Flora_of_Australia,Sporadanthus gracilis,resprouts after fire.,resprouts after fire,,,,,,resprouts,scored_from_excerpt,,,,,,,,,,,,,,,,,,,,,,,,,,,,,,,,,,,,,,,,,
ABRS_2022,Flora_of_Australia,Sporadanthus interruptus,resprouts after fire.,resprouts after fire,,,,,,resprouts,scored_from_excerpt,,,,,,,,,,,,,,,,,,,,,,,,,,,,,,,,,,,,,,,,,
ABRS_2022,Flora_of_Australia,Sporadanthus rivularis,resprouts after fire.,resprouts after fire,,,,,,resprouts,scored_from_excerpt,,,,,,,,,,,,,,,,,,,,,,,,,,,,,,,,,,,,,,,,,
ABRS_2022,Flora_of_Australia,Sporadanthus strictus,"obligate seeder, killed by fire, regeneration is by seed.",killed by fire; regenerates from seed,,,,,,fire_killed,scored_from_excerpt,post_fire_recruitment,scored_from_excerpt,,,,,,,,,,,,,,,,,,,,,,,,,,,,,,,,,,,,,,,
ABRS_2022,Flora_of_Australia,Sporadanthus tasmanicus,resprouts after fire.,resprouts after fire,,,,,,resprouts,scored_from_excerpt,,,,,,,,,,,,,,,,,,,,,,,,,,,,,,,,,,,,,,,,,
ABRS_2022,Flora_of_Australia,Stirlingia abrotanoides,shrub or perennial herb with fire-tolerant rootstock.,fire-tolerant rootstock,,,,,,resprouts,scored_from_excerpt,,,bud-bearing_root,scored_from_excerpt,,,,,,,,,,,,,,,,,,,,,,,,,,,,,,,,,,,,,
ABRS_2022,Flora_of_Australia,Stirlingia latifolia,flowering is enhanced the first season after fire.,flowering enhanced by fire,,,,,,,,,,,,,,,,,,,,,,,,,,,,fire_enhanced_flowering,scored_from_excerpt,,,,,,,,,,,,,,,,,,,
ABRS_2022,Flora_of_Australia,Stirlingia tenuifolia,"perennial herb with verrucose taproot, probably fire-sensitive.",fire-sensitive,,,,,,fire_killed,scored_from_excerpt,,,,,,,,,,,,,,,,,,,,,,,,,,,,,,,,,,,,,,,,,
ABRS_2022,Flora_of_Australia,Synaphea,"plants sometimes with fire-tolerant rootstock, sometimes suckering. seed set in most species, even fire-sensitive ones, is low.",inconclusive genus-level observation,,,,,,,,,,,,,,,,,,,,,,,,,,,,,,,,,,,,,,,,,,,,,,,,
ABRS_2022,Flora_of_Australia,Synaphea polymorpha,rootstock probably fire-tolerant.,fire-tolerant rootstock,,,,,,resprouts,scored_from_excerpt,,,rootstock,scored_from_excerpt,,,,,,,,,,,,,,,,,,,,,,,,,,,,,,,,,,rootstock,scored_from_excerpt,,
ABRS_2022,Flora_of_Australia,Synaphea spinulosa subsp. spinulosa,rootstock fire-tolerant.,fire-tolerant rootstock,,,,,,resprouts,scored_from_excerpt,,,rootstock,scored_from_excerpt,,,,,,,,,,,,,,,,,,,,,,,,,,,,,,,,,,rootstock,scored_from_excerpt,,
ABRS_2022,Flora_of_Australia,Taraxis,resprouts after fire or disturbance.,genus-level observation; resprouts after fire,,,,,,resprouts,scored_from_excerpt,,,,,,,,,,,,,,,,,,,,,,,,,,,,,,,,,,,,,,,,,
ABRS_2022,Flora_of_Australia,Taraxis grossa,regenerates after fire by resprouting.,resprouts after fire,,,,,,resprouts,scored_from_excerpt,,,,,,,,,,,,,,,,,,,,,,,,,,,,,,,,,,,,,,,,,
ABRS_2022,Flora_of_Australia,Tersonia brevipes,often abundant after fire.,common/found after fire,,,,,,,,post_fire_recruitment,scored_from_excerpt,,,,,,,,,,,,,,,,,,,,,,,,,,,,,,,,,,,,,,,
ABRS_2022,Flora_of_Australia,Thelychiton speciosus subsp. speciosus,notes plants of these orchids are commonly killed by hot fires but large clumps can often regenerate from vegetative buds surviving within the clump.,killed by hot fires; resprouts from surviving vegetative buds,,,,,,fire_killed resprouts,scored_from_excerpt,,,,,,,,,,,,,,,,,,,,,,,,,,,,,,,,,,,,,,,,,
ABRS_2022,Flora_of_Australia,Thelymitra abrupta,mostly seen on firebreaks and along edges of tracks.,no fire information,,,,,,,,,,,,,,,,,,,,,,,,,,,,,,,,,,,,,,,,,,,,,,,,
ABRS_2022,Flora_of_Australia,Thelymitra antennifera,flowering is greatly enhanced by summer fires resulting in impressive floral displays.,flowering enhanced by summer fires,,,,,summer,,,,,,,,,,,,,,,,,,,,,,,fire_enhanced_flowering,scored_from_excerpt,,,,,,,,,,,,,,,,,,,
ABRS_2022,Flora_of_Australia,Thelymitra aristata,"this is one of our most spectacular terrestrial orchids and flowering plants produce an impressive display, especially on burnt ground as they respond well to summer fires.",flowering enhanced by summer fires,,,,,summer,,,,,,,,,,,,,,,,,,,,,,,fire_enhanced_flowering,scored_from_excerpt,,,,,,,,,,,,,,,,,,,
ABRS_2022,Flora_of_Australia,Thelymitra azurea,this lovely species flowers in the absence of fire but is more frequent following summer burn.,flowers without fire; flowering enhanced by summer fires,,,,,summer,,,,,,,,,,,,,,,,,,,,,,,fire_enhanced_flowering,scored_from_excerpt,,,,,,,,,,,,,,,,,,,
ABRS_2022,Flora_of_Australia,Thelymitra benthamiana,flowering enhanced by summer fires.,flowering enhanced by summer fires,,,,,summer,,,,,,,,,,,,,,,,,,,,,,,fire_enhanced_flowering,scored_from_excerpt,,,,,,,,,,,,,,,,,,,
ABRS_2022,Flora_of_Australia,Thelymitra campanulata,notes flowering enhanced by summer fires.,flowering enhanced by summer fires,,,,,summer,,,,,,,,,,,,,,,,,,,,,,,fire_enhanced_flowering,scored_from_excerpt,,,,,,,,,,,,,,,,,,,
ABRS_2022,Flora_of_Australia,Thelymitra canaliculata,responds well to summer fires when dense swampy habitat is opened up by burning.,flowering enhanced by summer fires,,,,,summer,,,,,,,,,,,,,,,,,,,,,,,fire_enhanced_flowering,scored_from_excerpt,,,,,,,,,,,,,,,,,,,
ABRS_2022,Flora_of_Australia,Thelymitra epipactoides,"it responds strongly to summer fires, especially in overgrown habitats and studies suggest that this orchid may disappear from dense habitats that remain unburnt (calder et al.",flowering enhanced by summer fires,,,,,summer,,,,,,,,,,,,,,,,,,,,,,,fire_enhanced_flowering,scored_from_excerpt,,,,,,,,,,,,,,,,,,,
ABRS_2022,Flora_of_Australia,Thelymitra erosa,"flowering enhanced by summer fires, mowing and slashing.",flowering enhanced by summer fires,,,,,summer,,,,,,,,,,,,,,,,,,,,,,,fire_enhanced_flowering,scored_from_excerpt,,,,,,,,,,,,,,,,,,,
ABRS_2022,Flora_of_Australia,Thelymitra flexuosa,flowering enhanced by summer fires.,flowering enhanced by summer fires,,,,,summer,,,,,,,,,,,,,,,,,,,,,,,fire_enhanced_flowering,scored_from_excerpt,,,,,,,,,,,,,,,,,,,
ABRS_2022,Flora_of_Australia,Thelymitra fuscolutea,flowering enhanced by summer fires.,flowering enhanced by summer fires,,,,,summer,,,,,,,,,,,,,,,,,,,,,,,fire_enhanced_flowering,scored_from_excerpt,,,,,,,,,,,,,,,,,,,
ABRS_2022,Flora_of_Australia,Thelymitra grandiflora,"notes flowering plants produce spectacular display, especially on burnt ground.",flowering enhanced by fire,,,,,,,,,,,,,,,,,,,,,,,,,,,,fire_enhanced_flowering,scored_from_excerpt,,,,,,,,,,,,,,,,,,,
ABRS_2022,Flora_of_Australia,Thelymitra holmesii,flowering enhanced by summer fires.,flowering enhanced by summer fires,,,,,summer,,,,,,,,,,,,,,,,,,,,,,,fire_enhanced_flowering,scored_from_excerpt,,,,,,,,,,,,,,,,,,,
ABRS_2022,Flora_of_Australia,Thelymitra improcera,flowering enhanced by summer fires.,flowering enhanced by summer fires,,,,,summer,,,,,,,,,,,,,,,,,,,,,,,fire_enhanced_flowering,scored_from_excerpt,,,,,,,,,,,,,,,,,,,
ABRS_2022,Flora_of_Australia,Thelymitra jacksonii,flowering enhanced by summer fires.,flowering enhanced by summer fires,,,,,summer,,,,,,,,,,,,,,,,,,,,,,,fire_enhanced_flowering,scored_from_excerpt,,,,,,,,,,,,,,,,,,,
ABRS_2022,Flora_of_Australia,Thelymitra macrophylla,a very tall (to 1.5m) robust taxon with large flowers (to 50mm diameter) recorded n of augusta and n of walpole following summer fires also needs investigation.,no fire information,,,,,,,,,,,,,,,,,,,,,,,,,,,,,,,,,,,,,,,,,,,,,,,,
ABRS_2022,Flora_of_Australia,Thelymitra matthewsii,this interesting species colonises disturbed sites including slashed heathland and heathy forest and flowers more prolifically after summer fires and disturbance.,flowering enhanced by summer fires,,,,,summer,,,,,,,,,,,,,,,,,,,,,,,fire_enhanced_flowering,scored_from_excerpt,,,,,,,,,,,,,,,,,,,
ABRS_2022,Flora_of_Australia,Thelymitra media,flowering strongly enhanced by summer fires.,flowering enhanced by summer fires,,,,,summer,,,,,,,,,,,,,,,,,,,,,,,fire_enhanced_flowering,scored_from_excerpt,,,,,,,,,,,,,,,,,,,
ABRS_2022,Flora_of_Australia,Thelymitra mucida,flowering greatly enhanced by summer fires.,flowering enhanced by summer fires,,,,,summer,,,,,,,,,,,,,,,,,,,,,,,fire_enhanced_flowering,scored_from_excerpt,,,,,,,,,,,,,,,,,,,
ABRS_2022,Flora_of_Australia,Thelymitra odora,also colonising slashed firebreaks.,no fire information,,,,,,,,,,,,,,,,,,,,,,,,,,,,,,,,,,,,,,,,,,,,,,,,
ABRS_2022,Flora_of_Australia,Thelymitra polychroma,flowering is strongly enhanced by summer fires.,flowering enhanced by summer fires,,,,,summer,,,,,,,,,,,,,,,,,,,,,,,fire_enhanced_flowering,scored_from_excerpt,,,,,,,,,,,,,,,,,,,
ABRS_2022,Flora_of_Australia,Thelymitra rubra,flowering enhanced by slashing and summer fires.,flowering enhanced by summer fires,,,,,summer,,,,,,,,,,,,,,,,,,,,,,,fire_enhanced_flowering,scored_from_excerpt,,,,,,,,,,,,,,,,,,,
ABRS_2022,Flora_of_Australia,Thelymitra rubricaulis,also colonises disturbed sites such as slashed firebreaks and track margins.,no fire information,,,,,,,,,,,,,,,,,,,,,,,,,,,,,,,,,,,,,,,,,,,,,,,,
ABRS_2022,Flora_of_Australia,Thelymitra tubulina,notes flowers more freely after fires.,flowering enhanced by fire,,,,,,,,,,,,,,,,,,,,,,,,,,,,fire_enhanced_flowering,scored_from_excerpt,,,,,,,,,,,,,,,,,,,
ABRS_2022,Flora_of_Australia,Thelymitra uliginosa,flowering enhanced by summer fires.,flowering enhanced by summer fires,,,,,summer,,,,,,,,,,,,,,,,,,,,,,,fire_enhanced_flowering,scored_from_excerpt,,,,,,,,,,,,,,,,,,,
ABRS_2022,Flora_of_Australia,Thelymitra xanthotricha,flowering strongly enhanced by summer fires.,flowering enhanced by summer fires,,,,,summer,,,,,,,,,,,,,,,,,,,,,,,fire_enhanced_flowering,scored_from_excerpt,,,,,,,,,,,,,,,,,,,
ABRS_2022,Flora_of_Australia,Thynninorchis huntianus,"also colonises road embankments and track verges, even growing on infrequently used firetrails. notes readily killed by hot fires because the tiny, shallowly buried proto tubers are destroyed when the surface layer of litter burns. the impact of hot bushfires on this species was apparent following the 2003 fires in act and snowy mtns which completely destroyed many colonies.",killed by hot fires,,,high,,,fire_killed,scored_from_excerpt,,,,,,,,,,,,,,,,,,,,,,,,,,,,,,,,,,,,,,,,,
ABRS_2022,Flora_of_Australia,Tremulina,"killed by fire, regenerates by seed.",genus-level observation; killed by fire; regenerates from seed,,,,,,fire_killed,scored_from_excerpt,post_fire_recruitment,scored_from_excerpt,,,,,,,,,,,,,,,,,,,,,,,,,,,,,,,,,,,,,,,
ABRS_2022,Flora_of_Australia,Tremulina cracens,"killed by fire, regeneration is by seed.",killed by fire; regenerates from seed,,,,,,fire_killed,scored_from_excerpt,post_fire_recruitment,scored_from_excerpt,,,,,,,,,,,,,,,,,,,,,,,,,,,,,,,,,,,,,,,
ABRS_2022,Flora_of_Australia,Tremulina tremula,"killed by fire, regeneration is by seed.",killed by fire; regenerates from seed,,,,,,fire_killed,scored_from_excerpt,post_fire_recruitment,scored_from_excerpt,,,,,,,,,,,,,,,,,,,,,,,,,,,,,,,,,,,,,,,
ABRS_2022,Flora_of_Australia,Tribulopis angustifolia,"ants apparently play some role in the distribution of this species since latz & albrecht (latz 11901) recorded thousands of cocci covering a meat-ant's nest after fire. occurs in sand orsand/clay in a variety of habitats including tussock grassland, eucalyptuswoodlands, levee banks and red sand interdune areas associated with spinifex.it is often recorded after fire.",dispersed by ants; common/found after fire,,,,,,,,post_fire_recruitment,scored_from_excerpt,,,,,,,myrmecochory,scored_from_excerpt,ants,scored_from_excerpt,,,,,,,,,,,,,,,,,,,,,,,,,,,,,
ABRS_2022,Flora_of_Australia,Tribulus hirsutus,"usually in red sand or clay-sand in triodia,often appearing after fire, sometimes also in disturbed localities.",common/found after fire,,,,,,,,post_fire_recruitment,scored_from_excerpt,,,,,,,,,,,,,,,,,,,,,,,,,,,,,,,,,,,,,,,
ABRS_2022,Flora_of_Australia,Tribulus platypterus,some records indicate its presence afterfire.,common/found after fire,,,,,,,,post_fire_recruitment,scored_from_excerpt,,,,,,,,,,,,,,,,,,,,,,,,,,,,,,,,,,,,,,,
ABRS_2022,Flora_of_Australia,Tricostularia sandifordiana,noted to resprout and able to develop fertile growth within two years following fire.,resprouts after fire; secondary maturity period is within two years,,,,,,resprouts,scored_from_excerpt,,,,,,,,,,,,,,,,,,,,,,,,,,2,species,maximum,,,,,,,,,,,,,
ABRS_2022,Flora_of_Australia,Tricostularia sp. Porongurup (I. Abbott 18),it may be more obvious following fire as the vegetative ground cover was very dense at the time the survey to relocate the taxon was conducted.,no fire information,,,,,,,,,,,,,,,,,,,,,,,,,,,,,,,,,,,,,,,,,,,,,,,,
ABRS_2022,Flora_of_Australia,Tripterococcus brunonis,abundant after fire and in semi-disturbed sites.,common/found after fire,,,,,,,,post_fire_recruitment,scored_from_excerpt,,,,,,,,,,,,,,,,,,,,,,,,,,,,,,,,,,,,,,,
ABRS_2022,Flora_of_Australia,Tyrbastes glaucescens,regenerates by seed after fire.,regenerates from seed after fire,,,,,,fire_killed,scored_from_excerpt,post_fire_recruitment,scored_from_excerpt,,,,,,,,,,,,,,,,,,,,,,,,,,,,,,,,,,,,,,,
ABRS_2022,Flora_of_Australia,Velleia discophora,"grows in sandy and gravelly soils usually in open communities, appearing often after fire.",common/found after fire,,,,,,,,post_fire_recruitment,scored_from_excerpt,,,,,,,,,,,,,,,,,,,,,,,,,,,,,,,,,,,,,,,
ABRS_2022,Flora_of_Australia,Watsonia aletroides,flowers in spring and after fires.,flowering enhanced by fire; flowers without fire,,,,,,,,,,,,,,,,,,,,,,,,,,,,fire_enhanced_flowering,scored_from_excerpt,,,,,,,,,,,,,,,,,,,
ABRS_2022,Flora_of_Australia,Winifredia sola,probably resprouts after fire.,resprouts after fire,,,,,,resprouts,scored_from_excerpt,,,,,,,,,,,,,,,,,,,,,,,,,,,,,,,,,,,,,,,,,
ABRS_2022,Flora_of_Australia,xCyanthera glossodioides,flowering strongly enhanced by summer fires.,flowering enhanced by summer fires,,,,,summer,,,,,,,,,,,,,,,,,,,,,,,fire_enhanced_flowering,scored_from_excerpt,,,,,,,,,,,,,,,,,,,
ABRS_2022,Flora_of_Australia,Xylomelum angustifolium,plants regenerate after fire from a woody underground stock.,resprouts from woody underground stock after fire,,,,,,resprouts,scored_from_excerpt,,,rootstock,scored_from_excerpt,,,,,,,,,,,,,,,,,,,,,,,,,,,,,,,,,,rootstock,scored_from_excerpt,,
ABRS_2022,Flora_of_Australia,Xylomelum occidentale,"bark rough, flaky, often blackened by fire.",no fire information,,,,,,,,,,,,,,,,,,,,,,,,,,,,,,,,,,,,,,,,,,,,,,,,
ABRS_2022,Flora_of_Australia,Xylomelum scottianum,coppice leaves are sometimes found on plants which have recently been burnt.,coppices after fire,,,,,,resprouts,scored_from_excerpt,,,,,,,,,,,,,,,,,,,,,,,,,,,,,,,,,,,,,,,,,
ABRS_2022,Flora_of_Australia,Zygophyllum flavum,"occurs insandy loam or sand dunes, sometimes with mallee shrubland, possibly only afterfire or disturbance.",common/found after fire; fire ephemeral,,,,,,,,post_fire_recruitment,scored_from_excerpt,,,,,,,,,,,establish_just_after_fire_only,disturbance_ephemeral fire_ephemeral_facultative,,,,,,annual short_lived_perennial,,,,,,,,,,,,,,,,,,,,,
WAH_2022,Florabase_long,Acacia baileyana,fire response. fire stimulates mass germination of seed and generally kills adult plants.,killed by fire; regenerates from seed,,,,,,fire_killed,scored_from_excerpt,post_fire_recruitment,scored_from_excerpt,,,,,,,,,,,,,,,,,,,,,,,,,,,,,,,,,,,,,,,
WAH_2022,Florabase_long,Acacia dealbata,fire response. fire stimulates mass germination of soil-stored seed. adult plants will resprout from base and from root suckers following fire.,resprouts from base and root suckers and regenerates from seed after fire; soil seedbank,,,,,,resprouts,scored_from_excerpt,post_fire_recruitment,scored_from_excerpt,basal_buds bud-bearing_root,scored_from_excerpt,,,,,,,,,,,,,,,,,,,,,,,,,,,,soil,scored_from_excerpt,,,soil_seedbank_present,scored_from_excerpt,,,,
WAH_2022,Florabase,Acacia dealbata subsp. dealbata,,resprouts from base and root suckers and regenerates from seed after fire; soil seedbank (inferred from species),,,,,,resprouts,inferred_from_species,post_fire_recruitment,inferred_from_species,basal_buds bud-bearing_root,inferred_from_species,,,,,,,,,,,,,,,,,,,,,,,,,,,,soil,inferred_from_species,,,soil_seedbank_present,inferred_from_species,,,,
WAH_2022,Florabase_long,Acacia decurrens,fire response. fire stimulates mass germination of soil stored seed. adult plants can resprout from base following fire.,resprouts from base after fire; regenerates from seed after fire; soil-stored seedbank,,,,,,resprouts,scored_from_excerpt,post_fire_recruitment,scored_from_excerpt,basal_buds,scored_from_excerpt,,,,,,,,,,,,,,,,,,,,,,,,,,,,soil,scored_from_excerpt,,,soil_seedbank_present,scored_from_excerpt,,,,
WAH_2022,Florabase_long,Acacia elata,fire response. occasionally resprouts from base following fire.,sometimes resprouts from base after fire; regenerates from seed after fire; soil-stored seedbank,,,,,,fire_killed resprouts,scored_from_excerpt,post_fire_recruitment,scored_from_excerpt,,,,,,,,,,,,,,,,,,,,,,,,,,,,,,soil,scored_from_excerpt,,,soil_seedbank_present,scored_from_excerpt,,,,
WAH_2022,Florabase_long,Acacia floribunda,fire response. fire stimulates mass germination of soil stored seed. adult plants can resprout from root suckers following fire.,resprouts from root suckers and regenerates from seed after fire; soil-stored seedbank,,,,,,resprouts,scored_from_excerpt,post_fire_recruitment,scored_from_excerpt,bud-bearing_root,scored_from_excerpt,,,,,,,,,,,,,,,,,,,,,,,,,,,,,,,,,,,,,
WAH_2022,Florabase_long,Acacia iteaphylla,fire response. fire stimulates mass germination of seed and generally kills adult plants.,killed by fire; regenerates from seed,,,,,,fire_killed,scored_from_excerpt,post_fire_recruitment,scored_from_excerpt,,,,,,,,,,,,,,,,,,,,,,,,,,,,,,,,,,,,,,,
WAH_2022,Florabase_long,Acacia longifolia,fire response. fire stimulates mass germination of soil stored seed.,germination is stimulated by fire; soil-stored seedbank,,,,,,,,post_fire_recruitment,scored_from_excerpt,,,,,,,,,,,,,,,,,,,,,,,,,,,,,,soil,scored_from_excerpt,,,soil_seedbank_present,scored_from_excerpt,,,,
WAH_2022,Florabase_long,Acacia longifolia subsp. longifolia,fire response. fire stimulates mass germination of soil stored seed.,germination is stimulated by fire; soil-stored seedbank,,,,,,,,post_fire_recruitment,scored_from_excerpt,,,,,,,,,,,,,,,,,,,,,,,,,,,,,,soil,scored_from_excerpt,,,soil_seedbank_present,scored_from_excerpt,,,,
WAH_2022,Florabase_long,Acacia longifolia subsp. sophorae,fire response. fire stimulates mass germination of soil stored seed.,germination is stimulated by fire; soil-stored seedbank,,,,,,,,post_fire_recruitment,scored_from_excerpt,,,,,,,,,,,,,,,,,,,,,,,,,,,,,,soil,scored_from_excerpt,,,soil_seedbank_present,scored_from_excerpt,,,,
WAH_2022,Florabase_long,Acacia melanoxylon,fire response. fire stimulates mass germination of soil stored seed. adult plants will resprout and produce root suckers following fire.,resprouts from root suckers and regenerates from seed after fire; soil-stored seedbank,,,,,,resprouts,scored_from_excerpt,post_fire_recruitment,scored_from_excerpt,bud-bearing_root,scored_from_excerpt,,,,,,,,,,,,,,,,,,,,,,,,,,,,,,,,,,,,,
WAH_2022,Florabase_long,Acacia microbotrya,fire response. fire stimulates mass germination of soil stored seed. adult plants can resprout from base and from root suckers following fire.,resprouts from base and root suckers and regenerates from seed after fire; soil seedbank,,,,,,resprouts,scored_from_excerpt,post_fire_recruitment,scored_from_excerpt,basal_buds bud-bearing_root,scored_from_excerpt,,,,,,,,,,,,,,,,,,,,,,,,,,,,soil,scored_from_excerpt,,,soil_seedbank_present,scored_from_excerpt,,,,
WAH_2022,Florabase_long,Acacia podalyriifolia,fire response. fire stimulates mass germination of soil stored seed and kills adult plants.,killed by fire; regenerates from seed,,,,,,fire_killed,scored_from_excerpt,post_fire_recruitment,scored_from_excerpt,,,,,,,,,,,,,,,,,,,,,,,,,,,,,,,,,,,,,,,
WAH_2022,Florabase_long,Acacia pycnantha,fire response. fire stimulates mass germination of soil stored seed. adult plants can resprout following fire.,resprouts and regenerates from seed after fire; soil seedbank,,,,,,resprouts,scored_from_excerpt,post_fire_recruitment,scored_from_excerpt,,,,,,,,,,,,,,,,,,,,,,,,,,,,,,soil,scored_from_excerpt,,,soil_seedbank_present,scored_from_excerpt,,,,
WAH_2022,Florabase_long,Agapanthus praecox subsp. orientalis,"can change fire regimes in natural areas since plants are likely to be fire retardant, making heavily infested areas of bushland difficult to burn.",fire-retardant; changes fire regimes,,,,,,,,,,,,,,,,,,,,,,,,,,fire_retardant,,,,,,,,,,,,,,,,,,,,,,
WAH_2022,Florabase_long,Ailanthus altissima,fire response. will resprout vigorously following fire.,resprouts after fire,,,,,,resprouts,scored_from_excerpt,,,,,,,,,,,,,,,,,,,,,,,,,,,,,,,,,,,,,,,,,
WAH_2022,Florabase_long,Albuca canadensis,fire response. generally survives fire.,resprouts after fire,,,,,,resprouts,scored_from_excerpt,,,,,,,,,,,,,,,,,,,,,,,,,,,,,,,,,,,,,,,,,
WAH_2022,Florabase_long,Allium triquetrum,fire response. generally survives fire.,resprouts after fire,,,,,,resprouts,scored_from_excerpt,,,,,,,,,,,,,,,,,,,,,,,,,,,,,,,,,,,,,,,,,
WAH_2022,Florabase_long,Alopecurus myosuroides,"fire response. seed on the soil surface is killed by fire, while seed covered by shallow soil is protected and stimulated to germinate.",regenerates from seed after fire; soil seedbank,,,,,,,,post_fire_recruitment,scored_from_excerpt,,,,,,,,,,,,,,,,,,,,,,,,,,,,,,soil,scored_from_excerpt,,,soil_seedbank_present,scored_from_excerpt,,,,
WAH_2022,Florabase_short,Alstroemeria psittacina,"edge of disturbed swamp, open burnt paddock.",common/found after fire,,,,,,,,post_fire_recruitment,scored_from_excerpt,,,,,,,,,,,,,,,,,,,,,,,,,,,,,,,,,,,,,,,
WAH_2022,Florabase_long,Amaryllis belladonna,fire response. generally survives fire.,resprouts after fire,,,,,,resprouts,scored_from_excerpt,,,,,,,,,,,,,,,,,,,,,,,,,,,,,,,,,,,,,,,,,
WAH_2022,Florabase_long,Ammophila arenaria,"fire response. fire may provide an effective window for control, as it removes thatch and stimulates regrowth, creating ideal conditions for effective herbicide uptake.",regrowth after fire,,,,,,resprouts,scored_from_excerpt,,,,,,,,,,,,,,,,,,,,,,,,,,,,,,,,,,,,,,,,,
WAH_2022,Florabase_long,Anredera cordifolia,fire response.,no significant fire response,,,,,,no_significant_fire_response,scored_from_excerpt,,,,,,,,,,,,,,,,,,,,,,,,,,,,,,,,,,,,,,,,,
WAH_2022,Florabase_long,Anthoxanthum odoratum,fire response.,resprouts after fire,,,,,,resprouts,scored_from_excerpt,,,,,,,,,,,,,,,,,,,,,,,,,,,,,,,,,,,,,,,,,
