Genus Authority,Photosynthetic types,Species sampled,References,Notes
Aciachne Benth.,C3,Aciachne pulvinata Benth,Watson & Dallwitz (1992 onwards),
Acidosasa Chu & Chao,C3, -,BEP clade,
Acostia Swallen,C4, -,This study,"A. gracilis: Kranz anatomy (Morrone, pers. comm.); C4 isotope value = -12.9"
Acrachne Chiov.,C4," Acrachne racemosa Ohwi, Acrachne verticillata Wight & Arn.",Watson & Dallwitz (1992 onwards),
Acritochaete Pilger,C3,Acritochaete volkensii Pilger,Watson & Dallwitz (1992 onwards),
Acroceras Stapf,C3,"Acroceras macrum Stapf, Acroceras munroanum (Balansa) Henrard, Acroceras tonkinense (Balansa) C.E.Hubb. ex Bor, Acroceras zizanioides (Humb., Bonpl. & Kunth) Dandy",Metcalfe (1960); Watson & Dallwitz (1992 onwards),
Actinocladum Soderstrom,C3,Actinocladum verticillatum (Nees),Watson & Dallwitz (1992 onwards),
Aegilops L.,C3,"Aegilops crassa Boiss., Aegilops cylindrica Host, Aegilops triaristata Willd., Aegilops ventricosa Tausch",Metcalfe (1960); Watson & Dallwitz (1992 onwards),
Aegopogon Willd.,C4,Aegopogon cenchroides Willd.,Watson & Dallwitz (1992 onwards),
Aeluropus Trin.,C4,Aeluropus littoralis (Gouan) Parl.,Metcalfe (1960); Watson & Dallwitz (1992 onwards),
Afrotrichloris Chiov.,C4,Afrotrichloris martinii Chiov.,Watson & Dallwitz (1992 onwards),
Agenium Nees,C4,Agenium villosum Nees,Watson & Dallwitz (1992 onwards),
Agnesia Zuolaga & Jud.,C3, -,BEP clade,
Agropogon Fourn.,C3, -,BEP clade,
Agropyron Gaertn.,C3,"Agropyron cristatum (L.) J. Gaertner, Agropyron × laxum (Fr.) Tutin (Elymus), Agropyron caninum (L.) P.Beauv (Elymus), Agropyron elongatum (Host) P.Beauv. (Elymus), Agropyron intermedium (Host) P. Beauv. (Elymus), Agropyron scabrum (R.Br.) P.Beauv. (Elymus)",Watson & Dallwitz (1992 onwards),
Agropyropsis A.Camus,C3,Agropyropsis lolium (Batt. & Trab.) A. Camus,Watson & Dallwitz (1992 onwards),
Agrostis L.,C3,"Agrostis aemula R. Br., Agrostis australiensis Mez, Agrostis avenacea Gmelin, Agrostis billardieri R.Br., Agrostis stolonifera L. (=Agrostis stolonifera var. palustris (Huds.) Farw.), Agrostis tenuis Sibth. (= A. capillaris L.), Agrostis semiverticillata (Forssk.) C.Chr. (Polypogon)",Metcalfe (1960); Watson & Dallwitz (1992 onwards),
"Agrostopoa Davidse, Soreng & P. M. Peterson",C3,"Agrostopoa barclayae Davidse, Soreng & P. M. Peterson, Agrostopoa woodii Soreng, P. M. Peterson & Davidse",Davidse et al. (2009),
Aira L.,C3,"Aira cupiana Guss., Aira elegans Willd.",Watson & Dallwitz (1992 onwards),
Airopsis Desv.,C3,Airopsis tenella (Cav.) Ascherson & Graebner,Watson & Dallwitz (1992 onwards),
Alexfloydia Simon,C4,Alexfloydia repens B.K. Simon,Watson & Dallwitz (1992 onwards),
Alloeochaete C.E.Hubbard,C3,Alloeochaete geniculata (Rendle) C.E. Hubb.,Watson & Dallwitz (1992 onwards),
Allolepis Sod. & Deck.,C4,Allolepis texana (Vasey) Soderstrom & Decker,Watson & Dallwitz (1992 onwards),
Alloteropsis Presl,C4 & C3,"Alloteropsis cimicina (L.) Stapf, Alloteropsis semialata (R.Br.) Hitchc.",Metcalfe (1960); Ellis (1974); Hattersley et al. (1977); Watson & Dallwitz (1992 onwards),
Alopecurus L.,C3,"Alopecurus geniculatus L., Alopecurus myosuroides Huds, Alopecurus pratensis L.",Metcalfe (1960); Watson & Dallwitz (1992 onwards),
"Altoparadisium T.S. Filgueiras, G. Davidse, F.O. Zuloaga & O. Morrone",C4,"Altoparadisium chapadense T.S. Filgueiras, G. Davidse, F.O. Zuloaga & O. Morrone",Filgueras et al. (2001),
"Alvimia Cald., Sod. & Lond.",C3,Alvimia auriculata Soderstrom & Londoño,Watson & Dallwitz (1992 onwards),
Ammocalamagrostis Fourn.,C3, -,BEP clade,
Ammochloa Boiss.,C3,"Ammochloa involucrata Murbeck, Ammochloa palestina Boiss.",Watson & Dallwitz (1992 onwards),
Ammophila Host,C3,Ammophila arenaria (L.) Link,Metcalfe (1960); Watson & Dallwitz (1992 onwards),
"Ampelocalamus Chen, Wen & Sheng",C3, -,BEP clade,
Ampelodesmos Link,C3,Ampelodesmos mauritanicus (Poir.) Dur. & Schinz.,Metcalfe (1960); Watson & Dallwitz (1992 onwards),
Amphicarpum Kunth,C3,Amphicarpum muhlenbergianum (Schult.) Hitchc.,Metcalfe (1960); Watson & Dallwitz (1992 onwards),
Amphipogon R. Br.,C3,"Amphipogon amphipogonoides (Steud) Vickery, Amphipogon avenaceus R. Br., Amphipogon caricinus F. Muell., Amphipogon debilis R. Br., Amphipogon laguroides R. Br., Amphipogon strictus R. Br., Amphipogon turbinatus R. Br.",Watson & Dallwitz (1992 onwards),
Anadelphia Hack.,C4,"Anadelphia bigeniculata W.D. Clayton, Anadelphia leptocoma Pilger, Anadelphia pumila Jac.-Fél., ‘Anadelphia scyphofera’ W.D. Clayton, Anadelphia trepidaria (Stapf) Stapf",Watson & Dallwitz (1992 onwards),
Ancistrachne S.T.Blake,C3,Ancistrachne uncinulata (R. Br.) Blake,Watson & Dallwitz (1992 onwards),
Ancistragrostis S.T.Blake,C3,Ancistragrostis uncinioides S.T. Blake,Watson & Dallwitz (1992 onwards),
Andropogon L.,C4,"Andropogon schirensis Hochst., Andropogon virginicus L., Andropogon polyptychos Steud.  (=Dichanthium polyptychum (Steud.) A.Camus)",Metcalfe (1960); Watson & Dallwitz (1992 onwards),
Andropterum Stapf,C4,Andropterum variegatum Stapf (= A. stolzii),Watson & Dallwitz (1992 onwards),
Aniselytron Merr.,C3, -,BEP clade,
Anisopogon R. Br.,C3,Anisopogon avenaceus R. Br.,Watson & Dallwitz (1992 onwards),
Anomochloa Brongn.,C3,Anomochloa marantoidea Brongn.,Metcalfe (1960); Judziewcz and Soderstrom (1989),
Anthaenantia Beauv.,C4,Anthaenantia rufa (Ell.) Schult.,Watson & Dallwitz (1992 onwards),
Anthaenantiopsis Pilger,C4,Anthaenantiopsis trachystachya (Nees) Pilger,Morrone et al. (1993); Watson & Dallwitz (1992 onwards),
Anthephora Schreb.,C4,"Anthephora acuminata (Rendle) Stapf & Hubbard, Anthephora pubescens Nees",Metcalfe (1960); Watson & Dallwitz (1992 onwards),
Anthochloa Nees & Meyen,C3,Anthochloa lepidula Nees & Meyen,Metcalfe (1960); Watson & Dallwitz (1992 onwards),
Anthoxanthum L.,C3,Anthoxanthum odoratum L,Metcalfe (1960); Watson & Dallwitz (1992 onwards),
Antinoria Parl.,C3,Antinoria agrostidea (DC.) Parl.,Watson & Dallwitz (1992 onwards),
Apera Adanson,C3,Apera spica-venti (L.) Beauv.,Watson & Dallwitz (1992 onwards),
Aphanelytrum Hack.,C3,Aphanelytrum procumbens,Watson & Dallwitz (1992 onwards),
Apluda L.,C4,Apluda mutica L.,Metcalfe (1960); Watson & Dallwitz (1992 onwards),
Apochiton C.E.Hubbard,C4,Apochiton burttii Hubbard,Watson & Dallwitz (1992 onwards),
Apoclada McClure,C3,Apoclada cannavierira (Alvarado de Silviera) McClure,Watson & Dallwitz (1992 onwards),
Apocopis Nees,C4,"Apocopis courtallumensis (Steud.) Henr., Apocopis mangalorensis (Hochst.) Henr.",Watson & Dallwitz (1992 onwards),
Arberella Sod. & Cald.,C3,Arberella dressleri Soderstrom & Calderon,Watson & Dallwitz (1992 onwards),
Arctagrostis Griseb.,C3,Arctagrostis latifolia (R. Br.) Griseb.,Watson & Dallwitz (1992 onwards),
Arctophila Anders.,C3,Arctophila fulva (Trin.) N.J. Anderss.,Watson & Dallwitz (1992 onwards),
Aristida L.,C4 & C3,"Aristida adscensionis L., Aristida aemulans Melderis, Aristida brainii Melderis, Aristida congesta Roem. & Schult., Aristida caput-medusae Domin, Aristida hordeacea Kunth, Aristida kenyensis Henr., Aristida longifolia Trin., Aristida meridionalis Henr., Aristida ramosa R. Br., Aristida rhiniochloa Hochst., Aristida scabrivalvis Hack., Aristida setacea Retz., Aristida sieberiana Trin. (=Aristida longiflora Schumach. & Thonn.), Aristida stipitata Hack., Aristida vestita Thunb., Aristida pungens Desf. (Stipagrostis)",Metcalfe (1960); Watson & Dallwitz (1992 onwards); Cerros-Tlatilpa & Columbus (2009),A. longifolia: has non-Kranz leaf anatomy; Metcalfe (1960) lists broad surveys of the genus in the older literature.
Arrhenatherum Beauv.,C3,Arrhenatherum elatius (L.) Beauv.,Metcalfe (1960); Watson & Dallwitz (1992 onwards),
Arthragrostis Lazarides,C4,"Arthragrostis aristispicula B.K. Simon, Arthragrostis deschampsioides (Domin) Lazarides",Watson & Dallwitz (1992 onwards),
Arthraxon Beauv.,C4,Arthraxon hispidus (Thunb.) Makino,Metcalfe (1960); Watson & Dallwitz (1992 onwards),
Arthropogon Nees,C4,Arthropogon villosus Nees,Filgueiras (1982); Watson & Dallwitz (1992 onwards),
Arthrostylidium Rupr.,C3,"Arthrostylidium farctum (Aubl.) Soderstr. & Lourteig (=Arthrostylidium capillifolium Griseb.), Arthrostylidium pubescens Rupr.",Metcalfe (1960),
Arundinaria Michaux,C3,"Arundinaria alpina K. Schuman, Arundinaria sp.",Metcalfe (1960); Watson & Dallwitz (1992 onwards),
Arundinella Raddi,C4,"Arundinella metzii Hochst. ex Miq., Arundinella nepalensis Trin, Arundinella villosa Arn. ex Steud.",Metcalfe (1960); Watson & Dallwitz (1992 onwards),
Arundo L.,C3,Arundo donax L.,Metcalfe (1960); Watson & Dallwitz (1992 onwards),
Arundoclaytonia Davidse & Ellis,C3,Arundoclaytonia dissimilis Davidse & Ellis,Davidse and Ellis (1987),
Asthenochloa Buse,C4,Asthenochloa tenera Buse,Watson & Dallwitz (1992 onwards),Watson and Dallwitz (1992 onwards) note that this is based on observations of a very poor specimen
Astrebla F.Muell.,C4,"Astrebla pectinata (Lindl.) F. Muell. ex Benth., Astrebla squarrosa C.E.Hubb.",Metcalfe (1960); Watson & Dallwitz (1992 onwards),
Athroostachys Benth.,C3,Athroostachys capitata (Hook.) Benth.,Watson & Dallwitz (1992 onwards),
Atractantha McClure,C3,Atractantha falcata McClure,Watson & Dallwitz (1992 onwards),
Aulonemia Goudot,C3,Aulonemia fulgor McClure,Watson & Dallwitz (1992 onwards),
Austrochloris Lazarides,C4,Austrochloris dichanthoides (Everist) Lazarides,Watson & Dallwitz (1992 onwards),
Austroderia N. P. Barker & H. P. Linder,C3,Austroderia richardii (Endl.) N. P. Barker & H. P. Linder,Linder et al. (2010); Linder pers. comm.,
Austrofestuca Alexeev,C3,Austrofestuca littoralis (Labill.) A. Alexeev,Watson & Dallwitz (1992 onwards),
Avena L.,C3,"Avena fatua L., Avena sterilis subsp. ludoviciana (Durieu) Gillet & Magne (=Avena ludoviciana Durieu), Avena strigosa Schreb.",Metcalfe (1960); Watson & Dallwitz (1992 onwards),
Axonopus Beauv.,C4,Axonopus affinis Chase,Watson & Dallwitz (1992 onwards),
Bambusa Caldas,C3,"Bambusa arnhemica F. Muell., Bambusa multiplex (Lour.) Raeusch. ex Schult. (=Bambusa nana Roxb.),  Bambusa vulgaris Schrad.",Metcalfe (1960); Watson & Dallwitz (1992 onwards),
Baptorhachis Clayton & Renvoize,C4,Baptorhachis foliosa (Clayton) Clayton,Renvoize (1987),
Beckmannia Host.,C3,Beckmannia syzigachne (Steud.) Fernald,Watson & Dallwitz (1992 onwards),
Bewsia Goossens,C4,Bewsia biflora (Hack.) Goossens,"Watson & Dallwitz (1992 onwards), photos provided by R.P. Ellis",
Bhidea Bor,C4,Bhidea burnsiana Bor,Watson & Dallwitz (1992 onwards),
Blepharidachne Hack.,C4,"Blepharidachne bigelovii (S. Watts) Hack., Blepharidachne kingii (S. Watts) Hack.",Watson & Dallwitz (1992 onwards),
Blepharoneuron Nash,C4,Blepharoneuron tricholepis (Torr.) Nash,Watson & Dallwitz (1992 onwards) supplemented from Peterson and Annable (1990),
Boissiera Steud.,C3,Boissiera squarrosa (Banks & Soland.) Nevski,Watson & Dallwitz (1992 onwards),
Bonia Balansa,C3, -,BEP clade,
Bothriochloa Kuntze,C4,"Bothriochloa macra (Steudel) Blake, Bothriochloa bladhii (Retz.) S.T.Blake (=Bothriochloa caucasica (Trin.) C.E.Hubb.), Bothriochloa pertusa (L.) A.Camus",Metcalfe (1960); Watson & Dallwitz (1992 onwards),
Bouteloua Lag.,C4,"Bouteloua curtipendula (Michx.) Torr., Bouteloua gracilis (Kunth) Lag. Ex Griffiths (Chondrosum)",Metcalfe (1960); Watson & Dallwitz (1992 onwards),
Brachiaria Griseb.,C4,"Brachiaria eruciformis (J.E. Sm.) Griseb., Brachiaria deflexa (Schumach.) C.E.Hubb. ex Robyns, Brachiaria villosa (Lam.) A.Camus (=Brachiaria distichophylla (Trin.) Stapf), Brachiaria jubata (Fig. & De Not.) Stapf, Brachiaria reptans (L.) C.A.Gardner & C.E.Hubb,  Brachiaria paspaloides (J.Presl) C.E.Hubb. (Urochloa)",Metcalfe (1960); Watson & Dallwitz (1992 onwards),
Brachyachne Stapf,C4,Brachyachne convergens (F. Muell.) Stapf,Watson & Dallwitz (1992 onwards),
Brachychloa S.M.Phillips,C4,Brachychloa schiemanniana Phillips,"Watson & Dallwitz (1992 onwards), photos provided by R.P. Ellis",
Brachyelytrum Beauv.,C3,Brachyelytrum erectum Beauv.,Watson & Dallwitz (1992 onwards),
Brachypodium Beauv.,C3,"Brachypodium distachyon (L.) Beauv., Brachypodium pinnatum (L.) Beauv., Brachypodium sylvaticum (Huds.) P.Beauv",Metcalfe (1960); Watson & Dallwitz (1992 onwards),
Briza L.,C3,"Briza maxima L., Briza minor L., Briza triloba (= B. subaristata), Briza erecta Lam.",Metcalfe (1960); Watson & Dallwitz (1992 onwards),
Bromuniola C.E.Hubbard,C3,"Bromuniola gossweileri Stapf & C.E.Hubb, ",Metcalfe (1960); Watson & Dallwitz (1992 onwards),
Bromus L.,C3,"Bromus diandrus Roth, Bromus erectus Huds. (= Zerna), Bromus mollis L. (= B. hordeaceus L.), Bromus unioloides Kunth, Bromus carinatus Hook. & Arn (Bromus laciniatus Beal), Bromus coloratus Steud, Bromus riparius Rehmann (=Bromus fibrosus Hack.), Bromus inermis Leyss., Bromus japonicus Thunb., Bromus sterilis L., Bromus tectorum L., Bromus arvensis L., Bromus ciliatus L., Bromus lanceolatus Roth  (=Bromus macrostachys Desf.), Bromus rigidus Roth (=Bromus maximus Desf.), Bromus kalmii A.Gray (=Bromus purgans L.), Bromus ramosus Huds., Bromus secalinus L. (=Bromus velutinus Schrad.)",Metcalfe (1960); Watson & Dallwitz (1992 onwards),
Brylkinia Schmidt,C3,Brylkinia caudata (Munro) Fr. Schmidt,Metcalfe (1960); Watson & Dallwitz (1992 onwards),
Buchloe Engelm.,C4,Buchloë dactyloides (Nutt.) Engelm,Metcalfe (1960); Watson & Dallwitz (1992 onwards),
Buchlomimus J. & C. Reeder & Rzedowski,C4,Buchlomimus nervatus (Swallen) Reeder & Rzedowski,Watson & Dallwitz (1992 onwards),
Buergersiochloa Pilger,C3,Buergersiochloa bambusoides Pilger,Watson & Dallwitz (1992 onwards),
Calamagrostis Adanson,C3,Calamagrostis epigejos (L.) Roth,Metcalfe (1960); Watson & Dallwitz (1992 onwards),
Calamovilfa Scribn.,C4,Calamovilfa longifolia (Hook.) Hack.,Metcalfe (1960); Watson & Dallwitz (1992 onwards),
Calderonella Sod. & Deck.,C3,Calderonella sylvatica Soderstrom & Decker,Watson & Dallwitz (1992 onwards),
Calyptochloa C.E.Hubbard,C3,Calyptochloa gracillima Hubbard,Watson & Dallwitz (1992 onwards),
"Canastra Morrone, Zuloaga, Davidse & Filg.",C3,"Canastra lanceolata (Filgueras) Morrone, Zuloaga, Davidse & Filgueras",Morrone et al. (2001),
Capeochloa H. P. Linder & N. P. Barker,C3,Capeochloa cincta (Nees) N. P. & N. P. Barker,Linder et al. (2010); Linder pers. comm.,
Capillipedium Stapf,C4,Capillipedium spicigerum Blake,Metcalfe (1960); Watson & Dallwitz (1992 onwards),
Castellia Tineo,C3,Castellia tuberculosa (Moris) Bor,Watson & Dallwitz (1992 onwards),
Catabrosa Beauv.,C3,Catabrosa aquatica (L.) Beauv.,Metcalfe (1960); Watson & Dallwitz (1992 onwards),
Catalepis Stapf & Stent,C4,Catalepis gracilis Stapf & Stent,"Watson & Dallwitz (1992 onwards), photos provided by R.P. Ellis",
Catapodium Link,C3,"Catapodium loliaceum (Hudson) Link (= Desmazeria marina), Catapodium rigidum (L.) Hubbard, Catapodium marinum (L.) C.E.Hubb.",Metcalfe (1960); Watson & Dallwitz (1992 onwards),
Cathariostachys S.Dransfield,C3,Cathariostachys capitata (Kunth) S.Dransf. (=Nastus capitatus Kunth),BEP clade,
Cathestecum Presl,C4,Cathestechum erectum Vasey & Hack.,Watson & Dallwitz (1992 onwards),
Cenchrus L.,C4,"Cenchrus australis R. Br., Cenchrus biflorus Roxb., Cenchrus brownii Roem. & Schultes, Cenchrus ciliaris L., Cenchrus echinatus L., Cenchrus elymoides F. Muell., Cenchrus incertus M.A. Curtis (=Cenchrus pauciflorus Benth.), Cenchrus longispinus (Hack.) Fern., Cenchrus setiger Vahl.",Metcalfe (1960); Watson & Dallwitz (1992 onwards),
Centotheca Desv.,C3,"Centotheca sp., Centotheca lappacea (L.) Desvaux",Metcalfe (1960); Watson & Dallwitz (1992 onwards),
Centrochloa Swallen,C4,Centrochloa singularis Swallen,Watson & Dallwitz (1992 onwards),
Centropodia Reichenb.,C4,Centropodia glauca (Nees) T.A. Cope (Asthenatherum),Ellis (1984); Watson & Dallwitz (1992 onwards),
Cephalostachyum Munro,C3,"Cephalostachyum pergracile Munro, Cephalostachyum capitatum Munro",Metcalfe (1960); Watson & Dallwitz (1992 onwards),
Chaetium Nees,C4,Chaetium cubanum Hitchc.,Watson & Dallwitz (1992 onwards),
Chaetobromus Nees,C3,Chaetobromus dregeanus Nees,Linder et al. (2010); Linder pers. comm.; This study.,Non-Kranz anatomy in all sub-species; C3 isotope value = -27.3
Chaetopoa C.E.Hubbard,C4,Chaetopoa taylori C.E. Hubbard,Watson & Dallwitz (1992 onwards),
Chaetopogon Janchen,C3,Chaetopogon fasciculatus Link.,Watson & Dallwitz (1992 onwards),
Chamaeraphis R.Br.,C4,Chamaeraphis hordeacea R. Br.,Watson & Dallwitz (1992 onwards),
"Chandrasekharania Nair, Ramach. & Sreek.",C3,"Chandrasekharania keralensis Nair, Ramach. & Sreek.",Clayton & Renvoize (1986),
Chasmanthium Link,C3,"Chasmanthium latifolium (Michx.) Yates, Chasmanthium laxum (L.) Yates",Watson & Dallwitz (1992 onwards),
Chasmopodium Stapf,C4,Chasmopodium caudatum (Hack.) Stapf,Metcalfe (1960),
Chevalierella A.Camus,C3,"Chevalierella congoensis A. Camus (= C. dewildemanii), Chevalierella dewildemanii (Vand.) Van der Veken",Jacques-Félix (1962); Watson & Dallwitz (1992 onwards),
Chikusichloa Koidzumi,C3,Chikusichloa aquatica Koidz.,Watson & Dallwitz (1992 onwards),
Chimaerochloa H. P. Linder,C3,Chimaerochloa archboldii (Hitchc.) Pirie & H. P. Linder,Linder et al. (2010); Linder pers. comm.,
Chimonobambusa Makino,C3,Chimonobambusa densifolia Nakai,Watson & Dallwitz (1992 onwards),
Chimonocalamus Hsueh & Yi,C3, -,BEP clade,
Chionachne R.Br.,C4,Chionachne cyathopoda (Muell.) Muell. ex Benth.,Watson & Dallwitz (1992 onwards),
Chionochloa Zotov,C3,"Chionochloa conspicua (Forst.) Zotov (=Cortaderia conspicua (E.Forst.) Stapf and =Danthonia cunninghamii Hook.f.), Chionochloa frigida (Vickery) Conert, Chionochloa pallida (R. Br.) Conert, Chionochloa australis (Buchanan) Zotov (=Danthonia australis (Buchanan) Buchanan), Chionochloa bromoides (Hook.f.) Zotov (=Danthonia bromoides Hook.f.), Chionochloa crassiuscula (Kirk) Zotov (=Danthonia crassiuscula Kirk and =Danthonia pungens Cheeseman), Chionochloa rigida (Raoul) Zotov  (=Danthonia flavescens Hook.f. and =Danthonia rigida Raoul), Chionochloa oreophila (Petrie) Zotov (=Danthonia oreophila Petrie), Chionochloa ovata (Buchanan) Zotov (=Danthonia planifolia Petrie), Chionochloa teretifolia (Petrie) Zotov (=Danthonia teretifolia Petrie)",Watson & Dallwitz (1992 onwards),
Chloris Sw.,C4,"Chloris gayana Kunth, Chloris barbata Sw., Chloris filiformis (Vahl) Poir., Chloris pycnothrix Trin., Chloris robusta Stapf, Chloris virgata Sw., Chloris uliginosa Hack. (Eustachys)",Metcalfe (1960); Watson & Dallwitz (1992 onwards),
Chlorocalymma D.Clayton,C4,Chlorocalymma cryptocanthum W. Clayton,Watson & Dallwitz (1992 onwards),
Chondrosum Desv.,C4,Chondrosum gracile H. B. & K. (=Bouteloua gracilis (Kunth) Lag. Ex Griffiths),Watson & Dallwitz (1992 onwards),
Chrysochloa Swallen,C4,"Chrysochloa hindsii C.E.Hubb., Chrysochloa hubbardiana Germain & Risopoulos, Chrysochloa orientalis (Hubb.) Swallen",Watson & Dallwitz (1992 onwards); Observations on C. hindsi provided by Christine de Jong (2005),
Chrysopogon Trin.,C4,"Chrysopogon fallax Blake, Chrysopogon nodulibarbis (Hochst. ex Steud.) Henrard  (=Chrysopogon zeylanicus (Nees) Thwaites), Chrysopogon gryllus (L.) Trin.",Metcalfe (1960); Watson & Dallwitz (1992 onwards),
Chusquea Kunth,C3,"Chusquea longiligulata (Soderstrom & Calderon) Clark (= Swallenochloa), Chusquea abietifolia Griseb., Chusquea tenella Nees",Metcalfe (1960); Watson & Dallwitz (1992 onwards),
Cinna L.,C3,Cinna latifolia (Trev.) Griseb.,Watson & Dallwitz (1992 onwards),
Cladoraphis Franch.,C4,"Cladoraphis cyperoides (Thunb.) S.M. Phillips, Cladoraphis spinosa (L. f.) S.M. Phillips",Van den Borre (1994); Watson & Dallwitz (1992 onwards); Photos of C. cyperoides provided by R.P. Ellis,
Clausospicula Lazarides,C4,Clausospicula extensa M. Lazarides,Watson & Dallwitz (1992 onwards),
Cleistachne Benth.,C4,Cleistachne sorghoides Benth.,Metcalfe (1960),
Cleistochloa C.E.Hubbard,C3,Cleistochloa subjuncea Hubbard,Watson & Dallwitz (1992 onwards),
Cleistogenes Keng,C4,"Cleistogenes caespitosa Keng, Cleistogenes kitagawae Honda, Cleistogenes foliosa Keng, Cleistogenes songorica (Roshev.) Ohwi, Cleistogenes squarrosa (Trin.) Keng",Pyankov et al. (2000) [reported from earlier papers in Russian],
Coelachne R.Br.,C3,"Coelachne pulchella R. Br, Coelachne hackelii Merr., Coelachne perpusilla (Nees ex Steud.) Thwaites, Coelachne simpliciuscula (Steud.) Munro ex Benth.",Metcalfe (1960); Watson & Dallwitz (1992 onwards),
Coelachyrum Hochst. & Nees,C4,"Coelachyrum poaeflorum Chiov., Coelachyrum brevifolium Hochst. & Nees",Metcalfe (1960); Van den Borre (1994); Watson & Dallwitz (1992 onwards),
Coelorachis Brongn.,C4,Coelorachis rottboellioides (R. Br.) Camus,Watson & Dallwitz (1992 onwards),
Coix L.,C4,Coix lacryma-jobi L.,Metcalfe (1960); Watson & Dallwitz (1992 onwards),
Colanthelia McClure & Smith,C3,Colanthelia cingulata (McClure & Smith) McClure,Watson & Dallwitz (1992 onwards),
Coleanthus Seidel,C3,Coleanthus subtilis (Tratt.) Seidel.,Metcalfe (1960); Watson & Dallwitz (1992 onwards),
Colpodium Trin.,C3,"Colpodium altaicum Trin. (= Paracolpodium), Colpodium chionogeiton Pilg. (= Keinochloa)",Watson & Dallwitz (1992 onwards),
Cornucopiae L.,C3,Cornucopiae cucullatum L.,Watson & Dallwitz (1992 onwards),
Cortaderia Stapf,C3,"Cortaderia archboldii (Hitchc.) Connor & Edgar, Cortaderia bifida Pilger, Cortaderia selloana (Schultes & Schultes) Aschers & Graebner, Cortaderia conspicua (E.Forst.) Stapf (Chionochloa)",Metcalfe (1960); Watson & Dallwitz (1992 onwards),
Corynephorus Beauv.,C3,Corynephorus canescens (L.) Beauv.,Watson & Dallwitz (1992 onwards),
Cottea Kunth,C4,Cottea pappophoroides Kunth,Watson & Dallwitz (1992 onwards),
Craspedorhachis Benth.,C4,Craspedorhachis africana Benth.,Watson & Dallwitz (1992 onwards),
Crinipes Hochst.,C3,Crinipes abyssinicus (A. Rich.) Hochst.,Watson & Dallwitz (1992 onwards),
Crithopsis Jaub. & Spach,C3, -,BEP clade,
Crypsis Ait.,C4,Crypsis aculeata (L.) Ait.,Watson & Dallwitz (1992 onwards),
Cryptochloa Swallen,C3,Cryptochloa capillata (Trin.) Soderstrom,Watson & Dallwitz (1992 onwards),
Ctenium Panz.,C4,Ctenium polystachyum Balansa,Metcalfe (1960); Watson & Dallwitz (1992 onwards),
Cutandia Willk.,C3,"Cutandia dichotoma (Forsk.) Trab., Cutandia memphitica (Spreng.) Richt., Cutandia philistaea Benth.",Watson & Dallwitz (1992 onwards),
Cyathopus Stapf,C3, -,BEP clade,
Cyclostachya J. & C. Reeder,C4,Cyclostachya stolonifera (Scribn.) Reeder & Reeder,Watson & Dallwitz (1992 onwards),
Cymbopogon Spreng.,C4,"Cymbopogon refractus (R. Br.) Camus, Cymbopogon citratus (DC.) Stapf, Cymbopogon giganteus Chiov., Cymbopogon martini (Roxb.) W.Watson, Cymbopogon nardus (L.) Rendle (=Cymbopogon validus (Stapf) Stapf ex Burtt Davy)",Metcalfe (1960); Watson & Dallwitz (1992 onwards),
Cynodon L. Rich.,C4,Cynodon dactylon (L.) Pers.,Watson & Dallwitz (1992 onwards),
Cynosurus L.,C3,"Cynosurus cristatus L., Cynosurus echinatus L.",Metcalfe (1960); Watson & Dallwitz (1992 onwards),
Cyperochloa Lazarides & Watson,C3,Cyperochloa hirsuta Lazarides & Watson,Watson & Dallwitz (1992 onwards),
Cyphochlaena Hack.,C3,Cyphochlaena madagascariensis Hack.,Watson & Dallwitz (1992 onwards),
Cyrtochloa S.Dransfield,C3, -,BEP clade,
Cyrtococcum Stapf,C3,"Cyrtococcum sp., Cyrtococcum trigonum (Retz.) A.Camus",Metcalfe (1960); Watson & Dallwitz (1992 onwards),
Dactylis L.,C3,Dactylis glomerata L.,Watson & Dallwitz (1992 onwards),
Dactyloctenium Willd.,C4,"Dactyloctenium aegyptium (L.) Beauv., Dactyloctenium giganteum B.S.Fisher & Schweick",Metcalfe (1960); Watson & Dallwitz (1992 onwards),
Dallwatsonia Simon,C3,Dallwatsonia felliana B.K. Simon,Watson & Dallwitz (1992 onwards),
Danthonia DC.,C3,"Danthonia aff. alpicola Vickery (= Notodanthonia), Danthonia caespitosa Gaudich. (= Notodanthonia), Danthonia carphoides F. Muell. ex Benth. (= Notodanthonia), Danthonia dimidiata Vickery (= Rytidosperma), Danthonia linkii Kunth (= Notodanthonia), Danthonia nivicola Vickery (= Rytidosperma), Danthonia nudiflora Morris (= Rytidosperma), Danthonia procera Vickery (= Rytidosperma?), Danthonia ‘robusta’ (= Joycea pallida), Danthonia setacea R. Br. (= Notodanthonia), Danthonia alpina Vest  (=Danthonia calycina (Vill.) Rchb.), Danthonia compressa Austin, Danthonia decumbens (L.) DC., Danthonia spicata (L.) Roem. & Schult., Danthonia australis (Buchanan) Buchanan (Chionochloa), Danthonia bromoides Hook.f (Chionochloa), Danthonia buchananii Hook.f. (Rytidosperma), Danthonia crassiuscula Kirk (Chionochloa), Danthonia flavescens Hook.f. (Chionochloa), Danthonia oreophila Petrie (Chionochloa), Danthonia pilosa R.Br. (Rytidosperma), Danthonia planifolia Petrie (Chionochloa), Danthonia semiannularis (Labill.) R.Br. (Rytidosperma), Danthonia teretifolia Petrie (Chionochloa), Danthonia cunninghamii Hook.f. (Chionochloa), Danthonia pungens Cheeseman (Chionochloa), Danthonia rigida Raoul (Chionochloa)",Metcalfe (1960); Watson & Dallwitz (1992 onwards),
Danthonidium C.E.Hubbard,C3,Danthonidium gammiei C.E. Hubb.,Watson & Dallwitz (1992 onwards),
Danthoniopsis Stapf,C4,"Danthoniopsis barbata (Nees) C.E. Hubb., Danthoniopsis dinteri (Pilg.) C.E.Hubb., Danthoniopsis occidentalis Jac.-Fél., Danthoniopsis pruinosa C.E.Hubb.",Metcalfe (1960); Watson & Dallwitz (1992 onwards); Photos of D. dinteri and D. pruinosa provided by R.P. Ellis,
Dasypyrum Dur.,C3,Dasypyrum villosum (Coss. & Dur.) Dur.,Watson & Dallwitz (1992 onwards),
Davidsea Soderstrom & Ellis,C3, -,BEP clade,
Decaryella A.Camus,C4,Decaryella madagascariensis A. Camus,Watson & Dallwitz (1992 onwards),
Decaryochloa A. Camus,C3,Decaryochloa diadelpha A. Camus,Watson & Dallwitz (1992 onwards),
Dendrocalamus Nees,C3,"Dendrocalamus gigantus Munro, Dendrocalamus brandisii (Munro) Kurz",Metcalfe (1960); Watson & Dallwitz (1992 onwards),
Deschampsia Beauv.,C3,"Deschampsia caespitosa (L.) Beauv., Deschampsia flexuosa (L.) Trin.",Metcalfe (1960); Watson & Dallwitz (1992 onwards),
Desmazeria Dumort.,C3,Desmazeria marina (L.) Druce (Catapodium),Watson & Dallwitz (1992 onwards),
Desmostachya Stapf,C4,Desmostachya bipinnata (L.) Stapf,Metcalfe (1960); Watson & Dallwitz (1992 onwards),
